ATG GCT CTG ACA AAG GTG CCT GGG ACC TGC TTA CTC ACC ATT CGT GTC CTG CAG GCT CAT GGC CTG CCC TCC AAG GAC CTC GTG ACC GCC TCT GAC TGC TAC GTG ACC CTG TGG CTG CCC ACG GCC TCC AGC CAC CAG CTG CAA ACG CGC ACA GTC AAG AAC TGC AGA AAC CCC GTC TGG AAT CAA AGC TTC CAC TTC CGA ATC CAT AGC CAG ATC AAG AAC ATC GTG CAT CTT AGA GTC TTT GAC CAG GAC CTT CTG ACC ACG GAT GAC CCC GTG TTG TCA GTG CTG TTT GAT GTG GGG ACC TTG CGG GCT GGG GAG TCC CGG CGT GAG AGC TTC TCG CTG AGC CCT CAG GGT GAG GAG CGC CTG GAA GTT GAA TTT CGG CTG CAG AAT CTG ACT GAT GGT GCT GAG TGC CTC TTC AGC AAT GGC ATC CTA GTG GCC CGG GAG CTC TCC TGC TTG CAT GTT CGA CTG GAG AAG GCA GGG GAC CTG CAG GAG TCA GAG GGC AGA GTT CAG CTT GTG GTT CAC GGG TCC TGT GAG GGT CCA CAG GAG GCC TCC GTG GGC GCC GGC TCC TTC CGC TTC CAT TGG CCG GCC TGC TGG GAG CAG GAG CTG AGT ATT CAC CTG CAG GAT GCC CCC CAG GAG CAG CTG AAG GTG CCC CTG AGG GCC CTG CCT TCT GGC CAA GTG GTG CGA CTT GTC TTC CCT ACA TCC CAG GAG CCC CTG ATG ACA GTG GAG CTG AAA AAT GAA GAA GGA CCG AGG GAA CTG GCT GTG CGG CTG GGC TGT GGG CCC TGT GCT GAG GAG CAG GCC TTC CTG AGC AGG AGG AAG CAG GTG GTG GCC AAG GCC CTG CAG CAG GCC CTG CAG CTG GAC GGA GAC CTG CGG GAA GAT GAG ATC CCA GTG GTT GCT GTT ATG GCC ACC GGT GGT GGT ATC CGG GCC ATG ACC TCA CTG TAT GGG CAG CTG GCT GGC CTA AAG GCG CTC GGC CTC TTG GAT TGT GTC TCC TAC ATC ACG GGG GCC TCG GGC TCC ACC TGG GCT TTG GCC AAC CTC TAC GAG GAT CCA GAG TGG TCT CAG AAG GAC CTG GCA GGG CCC ATC GAG TCA CTG AAG ACC CAG GTG ACC AAG AGC AAG CTG GGC GTG CTA GCC CCC AGG CAG CTA CTG CGG TAC CAG CAG GAG CTG GCT GAG CGT GCC CGC CTG GGC CAC CCA ACC TGC TTC ACC AAC CTG TGG GCC CTC ATC AAT GAG GCG CTG CTA CAT GAT GAG CCT CAT GAC CAC AAG CTC TCA GAC CAG CGG GAG GCC CTG AGT CGA GGC CAG AAC CCC ATG CCC ATC TAC TGT GCT CTC AAC ACG AAG GAG CAG AAT CTG ACC ACC TTT GAA TTT GGG GAG TGG TGT GAG TTC TCC CCC TAT GAG GTC GGC TTT CCC AAG TAC GGT GCC TTC ATC CCC CCC GAG CTC TTT GGC TCT GAG TTC TTC ATG GGG CGC CTG ACA AAA CAG CTT CCT GAG TCC CGC ATC TGT TTC CTG GAA GGT ATC TGG AGC AAC CTG TAT GCA GCC AAC CTC CAG GAC AGC CTG TAC TGG TCA TCC GAG CCC AGC CAG TTC TGG GAC CGC TGG GCA CAA GCC CGG GCC AGC CTA GAC AAG GAG CAG GTC CCC CTT CTG AAG ATA CAA GAG CCT CCC ACG GTG GCT GGC AGG ATA GCA GAG GTT TTC ACT GAC CTT TTG ACA CGG CGT CCA CTT GCC CAG GCC ACC CAC AAT TTC CTA CGT GGT TTC TCC TTC CAC AAG AAC TAT TTT CAG CAT CCT CAC TTT TCT GCC TGG AAA GCT ACC AAG CTG GAC GGC CTC CCC AAC GAG CTG ACA CCT GCA GAG CCC TAC CTT TGC TTG CTG GAT GTT GGT TAC CTT GTC AAT ACC AGC TGC CCA CCC CTC CTG CCA CCC ACA CGG GAC GTG GAC CTC ATC CTG TCG CTA GAT TAC AAT CTC CAT GGA GCC TTC CAG CAG CTG CAG CTT CTG AGT CGG TTC TGC CAG GAG CAG GGC ATC CCA TTC CCG CCC ATC TCG CCA AGC CCC GAG GAG CAG CGC CAG CCC CAA GAG TGC CAC CTC TTC TCG GAC CCC ACC CGC CCC GAC ATC CCT GCC GTG CTG CAC TTC CCT CTG GTC AAC GCC TCC TTC AGG GAC CAC TCT GCC CCC GGG GTC CGG CGG ACA GCT GAG GAG CAG GCA GCT GGG GAG GTG AAC TTA TCT GCA TCC GAC TCC CCC TAC CAC TAC TCG AAG GTA ACC TAC AGC CTG GAG GAT GTG GAC AAG CTA CTC CGC CTG ACG CAG TAC AAC ATC TGC AAC AAC CAG GAG CGG CTG CTG GAG GCC CTG CGT GAG GCC GTG CAG AGG CGG AGG CAG CGC ACA CAG CGC CGG CCC GAG ,13.9
ATG CCC TCG GCC GCC GCC CCC ATT ATC AGC TCG GTC CAG AAG CTG GTT CTG TAT GAA ACT AGA GCT AGA TAC TTC CTA GTT GGG AGC AAT AAT GCA GAA ACG AAA TAT CGT GTC TTG AAG ATT GAT AGA ACA GAA CCA AAA GAT TTG GTC ATA ATT GAT GAC AGG CAT GTC TAT ACT CAG CAA GAA GTA AGG GAA CTT CTT GGG CGC TTG GAT CTT GGA AAT AGA ACA AAG ATG GGA CAG AAA GGA TCC TCG GGC TTA TTT CGA GCG GTT TCA GCT TTT GGT GTT GTG GGT TTT GTC AGG TTC TTA GAA GGG TAT TAT ATT GTG TTA ATA ACT AAA AGG AGG AAG ATG GCG GAT ATT GGA GGT CAT GCA ATC TAT AAG GTC GAA GAT ACA AAT ATG ATC TAT ATA CCT AAT GAT TCT GTA CGG GTT ACT CAT CCT GAT GAA GCT AGG TAT CTA CGA ATA TTT CAA AAT GTG GAC CTA TCT AGC AAT TTT TAC TTC AGT TAC AGC TAT GAT TTG TCC CAC TCA CTT CAA TAT AAT CTC ACT GTC TTG CGA ATG CCC CTG GAG ATG TTA AAG TCA GAA ACG ACC CAG AAT CGC CAA GAG AGC TTT GAC ATC TTT GAA GAT GAA GGA TTA ATT ACA CAA GGT GGA AGC GGG GTA TTT GGC ATC TGT AGT GAG CCT TAT ATG AAA TAT GTA TGG AAT GGT GAA CTT CTG GAT ATA ATT AAA AAT ACT GTG CAT CGT GAC TGG CTT TTG TAT ATT ATT CAT GGG TTC TGT GGG CAG TCA AAG CTG TTG ATC TAT GGA CGA CCA GTG TAT GTC ACT CTA ATA GCT AGA AGA TCC AGT AAA TTT GCT GGC ACC CGT TTT CTT AAA AGA GGT GCA AAC TGT GAG GGT GAT GTT GCA AAT GAA GTG GAG ACT GAA CAA ATA CTT TGT GAT GCT TCT GTG ATG TCT TTC ACT GCA GGA AGT TAT TCT TCT TAC GTA CAA GTT AGA GGA TCT GTG CCC TTA TAC TGG TCT CAG GAC ATT TCA ACT ATG ATG CCT AAA CCA CCT ATT ACA TTG GAT CAG GCA GAT CCA TTT GCA CAT GTG GCT GCC CTT CAC TTT GAC CAG ATG TTT CAG AGG TTT GGC TCT CCC ATC ATC ATC TTG AAT TTG GTG AAG GAA CGA GAG AAA AGA AAG CAT GAA AGA ATT CTG AGT GAA GAA CTT GTT GCT GCT GTG ACC TAT CTC AAC CAG TTT TTG CCT CCT GAG CAC ACT ATT GTT TAT ATT CCC TGG GAC ATG GCC AAG TAT ACC AAA AGC AAG CTG TGT AAT GTT CTT GAT CGA CTG AAT GTG ATT GCA GAA AGT GTG GTG AAG AAA ACA GGT TTC TTT GTA AAC CGC CCT GAT TCC TAC TGT AGC ATT TTG CGG CCA GAT GAA AAG TGG AAT GAA CTA GGA GGA TGT GTG ATT CCC ACT GGT CGC CTG CAG ACT GGC ATC CTT CGA ACC AAC TGT GTG GAC TGT TTA GAT CGC ACC AAC ACA GCA CAG TTT ATG GTG GGA AAA TGT GCT CTG GCC TAT CAG CTG TAT TCA TTG GGA CTG ATC GAC AAA CCT AAT CTA CAG TTT GAT ACA GAT GCA GTT AGG TTA TTT GAG GAA CTC TAT GAA GAT CAT GGT GAT ACC CTA TCC CTT CAG TAT GGT GGT TCT CAA CTT GTT CAT CGT GTG AAA ACC TAC AGA AAG ATA GCA CCG TGG ACC CAG CAC TCA AAA GAC ATC ATG CAA ACC CTG TCT AGA TAT TAC AGC AAT GCT TTT TCA GAT GCT GAT AGA CAA GAT TCC ATT AAT CTC TTC CTG GGA GTT TTC CAT CCC ACT GAA GGG AAA CCT CAT CTC TGG GAA CTC CCA ACA GAT TTT TAT TTG CAT CAC AAA AAT ACC ATG AGA CTT TTG CCA ACA AGA AGA AGT TAT ACT TAC TGG TGG ACA CCA GAG GTG ATA AAG CAT TTA CCA TTA CCC TAT GAT GAA GTT ATC TGT GCT GTG AAC TTA AAG AAG TTG ATA GTG AAG AAA TTC CAC AAA TAT GAA GAA GAG ATT GAT ATC CAC AAT GAG TTC TTT CGG CCA TAT GAG TTG AGC AGC TTT GAT GAT ACC TTT TGC TTG GCT ATG ACA AGC TCA GCA CGT GAC TTT ATG CCT AAG ACT GTT GGA ATT GAT CCA AGT CCA TTT ACT GTG CGT AAA CCA GAT GAA ACT GGA AAA TCA GTA TTG GGA AAC AAA AGC AAT AGA GAA GAA GCT GTA TTA CAG CGG AAA ACG GCA GCC AGT GCC CCG CCG CCC CCC AGC GAG GAG GCT GTG TCC AGC AGC TCT GAG GAT GAC TCT GGG ACT GAT CGG GAA GAG GAG GGC TCT GTG TCT CAG CGC TCC ACT CCC GTG AAG ATG ACG GAC GCA GGA GAC AGT GCC AAA GTG ACC GAG AAT GTG GTC CAA CCC ATG AAG GAG CTA TAT GGA ATT AAC CTC TCA GAT GGC CTC TCA GAA GAA GAT TTC TCC ATT TAT TCA AGA TTT GTT CAG CTG GGG CAG AGT CAA CAT AAA CAA GAC AAG AAT AGC CAG CAG CCC TGT TCC AGG TGC TCA GAT GGA GTT ATA AAA CTG CAT TGT GAA GAC CCT GTT TCC CTA GCT GTG CAG CTG CAA GGT CAC TAC ACA GAT AAA CTC AAG TCA CAA AAC GTG TTT TTC CTT GAA AAG ,27.0
ATG TCG GAC AAA AGT GAA TTA AAG GCA GAA TTG GAA CGT AAG AAG CAG CGG TTG GCC CAA ATC AGA GAG GAA AAG AAG AGA AAA GAA GAA GAA AGG AAA AAA AAG GAA ACT GAT CAG AAG AAG GAA ACA GTT GCT CCT GTG CAA GAA GAG TCA GAT CTT GAA AAA AAA AGA AGA GAA GCT GAA GCA TTG CTT CAA AGC ATG GGG CTA ACT CCA GAA TCC CCC ATT GTT TTT TCT GAA TAC TGG GTC CCT CCT CCT ATG TCT CCA TCC TCC AAA TCT GTG AGC ACA CCA AGT GAA GCT GGA AGC CAA GAC TCT GGA GAT GGC GCA GTG GGA TCT AGG ACG CTG CAT TGG GAT ACA GAT CCA TCA GTT CTT CAG CTT CAC TCA GAT TCC GAT TTG GGA CGA GGA CCT ATT AAA CTT GGA ATG GCT AAA ATT ACA CAA GTT GAC TTT CCT CCT CGA GAA ATC GTC ACA TAT ACA AAG GAA ACT CAG ACT CCA GTT ATG GCT CAG CCC AAA GAA GAT GAA GAG GAA GAA GAT GAC GTA GTG ACT CCT AAA CCA CCT ATT GAA CCA GAA GAA GAG AAA ACT TTA AAG AAA GAT GAA GAA AAT GAT AGT AAA GCT CCC CCT CAT GAG CTG ACT GAA GAA GAA AAG CAA CAA ATC TTA CAC TCG GAG GAG TTT TTA AGT TTC TTT GAC CAT TCC ACA AGA ATT GTA GAA AGA GCT CTT TCT GAG CAG ATT AAC ATC TTC TTT GAC TAC AGC GGA AGA GAT TTA GAA GAC AAA GAA GGA GAG ATT CAA GCA GGT GCT AAA CTG TCA TTA AAT CGA CAA TTT TTT GAT GAA CGT TGG TCA AAA CAT CGT GTT GTT AGT TGT TTG GAT TGG TCA TCT CAG TAT CCA GAG CTA CTC GTG GCT TCC TAT AAT AAC AAT GAA GAT GCT CCT CAC GAG CCG GAT GGT GTG GCC CTT GTA TGG AAT ATG AAA TAC AAA AAA ACT ACC CCC GAA TAT GTG TTT CAC TGC CAG TCA GCT GTG ATG TCT GCT ACG TTT GCA AAA TTT CAT CCA AAT CTG GTT GTT GGT GGT ACA TAT TCA GGC CAA ATT GTG CTG TGG GAT AAC CGT AGC AAT AAA AGA ACT CCA GTG CAG AGA ACT CCG CTG TCA GCT GCT GCA CAC ACA CAT CCT GTA TAT TGT GTA AAT GTT GTT GGA ACA CAA AAT GCT CAC AAT CTG ATT AGC ATA TCT ACT GAT GGA AAA ATT TGT TCA TGG AGT CTG GAC ATG CTT TCC CAT CCA CAG GAT AGC ATG GAA TTG GTT CAT AAA CAG TCA AAG GCA GTA GCT GTG ACA TCT ATG TCC TTC CCT GTT GGA GAT GTC AAC AAC TTT GTT GTT GGG AGT GAA GAA GGT TCC GTG TAC ACA GCA TGC CGC CAT GGC AGC AAA GCT GGA ATC AGT GAG ATG TTT GAG GGA CAT CAA GGA CCA ATC ACT GGT ATC CAT TGT CAT GCA GCT GTT GGA GCA GTG GAC TTC TCA CAT CTT TTT GTC ACT TCA TCA TTT GAC TGG ACA GTA AAA CTT TGG ACA ACT AAG AAT AAC AAG CCT TTG TAT TCA TTT GAA GAT AAT TCA GAC TAT GTT TAT GAT GTT ATG TGG TCA CCC ACC CAC CCA GCC CTG TTT GCT TGT GTG GAT GGC ATG GGG AGG CTG GAT TTG TGG AAT CTC AAT AAT GAC ACT GAG GTG CCA ACT GCC AGC ATT TCT GTG GAG GGT AAT CCT GCT CTT AAT CGT GTA AGA TGG ACT CAT TCT GGA AGA GAG ATT GCT GTG GGT GAT TCT GAA GGA CAG ATT GTC ATA TAT GAC GTG GGA GAG CAG ATT GCT GTC CCC CGA AAT GAT GAA TGG GCA CGG TTT GGC CGA ACG CTT GCA GAA ATT AAT GCA AAC CGA GCT GAT GCA GAG GAG GAA GCA GCT ACC CGA ATA CCT GCT ,28.0
ATG GAC CTG AGA TCC GGG CAA GAG TTT GAT GTG CCT ATC GGG GCG GTG GTG AAG CTC TGC GAC TCT GGG CAG ATC CAG GTG GTG GAT GAT GAA GAC AAC GAA CAC TGG ATC TCC CCG CAG AAC GCC ACG CAC ATC AAG CCC ATG CAT CCC ACG TCT GTC CAC GGC GTG GAG GAC ATG ATC CGC CTG GGG GAC TTG AAC GAG GCG GGC ATC CTG CGC AAC CTG CTC ATC CGC TAC CGG GAC CAC CTC ATC TAC ACA TAC ACG GGC TCC ATC CTG GTG GCT GTG AAC CCC TAC CAG CTG CTC TCC ATC TAC TCG CCA GAG CAC ATC CGC CAG TAC ACC AAC AAG AAG ATT GGG GAA ATG CCC CCT CAC ATT TTT GCT ATC GCT GAC AAT TGC TAC TTC AAC ATG AAA CGC AAC AGC CGC GAC CAG TGC TGC ATC ATC AGT GGG GAG TCT GGG GCA GGG AAG ACG GAG AGC ACA AAG CTG ATC CTG CAG TTC CTG GCG GCC ATC AGT GGG CAG CAC TCG TGG ATT GAG CAG CAG GTG CTG GAG GCC ACC CCC ATC CTG GAA GCA TTT GGA AAT GCC AAG ACC ATC CGC AAC GAC AAC TCA AGC CGC TTC GGG AAG TAC ATC GAC ATC CAC TTC AAC AAG CGG GGG GCC ATT GAG GGC GCC AAG ATC GAG CAG TAC CTG CTG GAG AAG TCC CGT GTC TGT CGC CAG GCC CCA GAT GAA AGG AAT TAC CAT GTG TTC TAC TGC ATG CTG GAG GGC ATG AGC AAG GAG CAG AAG AAG AAG CTG GGC CTG GGC CAG GCC ACC GAC TAT AAC TAC TTG GCC ATG GGT AAC TGC ATC ACC TGT GAG GGC CGG GAG GAC AGC CAG GAG TAC GCC AAC ATC CGT TCC GCC ATG AAG GTG CTC ATG TTC ACC GAC ACC GAG AAC TGG GAG ATC TCG AAG CTC CTG GCC GCC ATC CTG CAC CTG GGC AAC CTG CAG TAT GAG GCC CGC ACG TTT GAA AAC CTG GAC ACC TGT GAG GTT CTC TTC TCC CCG TCT CTG GCC ACA GCT GCA TCC CTG CTC GAG GTG AAC CCC CCA GAC CTG ACG AAC TGC CTG ACG AGC CGC ACC CTC ATC ACC CGC GGG GAG ACC GTG TCC ACC CCA CTC AGT AGG GAG CAG GCA CTG GAT GTG CGG GAC GCC TTT GTC AAG GGC ATC TAC GGG CGG CTC TTT GTG TGG ATC GTG GAC AAG ATC AAT GCG GCG ATT TAC AAG CCC CCC TCC CAG GAA GTG AAG AAC TCT CGC CGA TCC ATC GGC CTC CTG GAC ATC TTT GGA TTT GAG AAC TTT TCT GTG AAC AGC TTC GAG CAG CTC TGC ATC AAC TTC GCC AAT GAG CAC CTG CAG CAG TTC TTT GTG CGC CAT GTG TTC AAG CTG GAG CAG GAG GAG TAT GAC CTG GAG AGC ATC GAT TGG CTG CAC ATT GAG TTC ACC GAC AAC CAG GAC GCC CTG GAC ATG ATT GCC AAC AGG CCC ATG AAC ATC ATC TCC CTC ATC GAT GAG GAG AGC AAG TTC CCC AAG GGC ACA GAC ACC ACC ATG CTG CAT AAG CTG AAC TCC CAG CAC AAG CTC AAT GCC AAC TAC ATC CCT CCC AAG AAC AAC CAC GAG ACC CAG TTT GGG ATC AAC CAC TTT GCC GGC ATC GTC TAC TAT GAG ACC CAA GGC TTC CTG GAG AAG AAC CGG GAT ACC CTG CAT GGA GAC ATC ATC CAG CTG GTC CAC TCC TCC AGG AAC AAG TTC ATC AAG CAG ATC TTC CAG GCG GAC GTG GCC ATG GGC GCC GAG ACC AGG AAG CGC TCG CCC ACA CTC AGC AGC CAG TTC AAG CGG TCG CTG GAG CTG CTG ATG CGC ACG CTG GGG GCC TGC CAG CCC TTC TTC GTG CGC TGC ATC AAG CCC AAC GAG TTC AAG AAG CCC ATG CTG TTC GAC CGG CAA CTG TGC GTG CGT CAG CTG CGG TAC TCA GGG ATG ATG GAA ACC ATC CGA ATC CGC CGA GCC GGC TAC CCC ATC CGC TAC AGC TTT GTG GAG TTC GTT GAG CGG TAC CGT GTG CTG CTG CCT GGT GTG AAG CCA GCC TAC AAG CAG GGT GAC CTG CGG GGG ACA TGC CAG CGC ATG GCC GAG GCT GTG CTG GGC ACC CAC GAT GAC TGG CAG ATT GGC AAG ACT AAG ATC TTT CTG AAG GAC CAC CAC GAC ATG CTG CTG GAG GTA GAG CGG GAC AAG GCC ATC ACC GAC AGA GTC ATC CTT CTC CAG AAG GTC ATC CGG GGC TTC AAA GAC AGG TCC AAC TTC CTG AAG CTG AAG AAC GCT GCC ACG CTG ATC CAG AGG CTC TGG CGG GGC CAC AAC TGC CGG AGG AAC TAC GAG CTG ATG CGG CTG GGC TTC CTG CGG CTG CAG GCC CTG CAC CGC TCC CGG ACG CTG CAC CAG CAG TAC TGC CTG GCC CGC CGG CAC ATC ATC CGG TTC CAG GCC CGC TGC CGC GCC TAC CTG GTG CGC AGG GCC TTC CGC CAC CGC CTC TGG GCC GTG TTC ACC GTG CAG GCC TAC GCC CGG GGC ATG ATC GCC CGC AGG CTG CAC CGG CGC CTC AGG GCC GAG TAC CTG CGG CGC CTC GAG GCC GAG AAA ATG CGG CTG GCG GAG GAG GAG AAG CTG CGG AAG GAG ATG AGC GCC AAG AAG GCC AAG GAG GAG GCA GAA CGC AAG CAC CAG GAG CGC CTG GCC CAA CTG GCT CTG GAG GAT GCA GAG CGG GAG CTG AAG GAG AAG GAG GCA GCC CGG CGG AAG AAG GAG CTC CTG GAG CAG ATG GAG AAG GCC CGC CAC GAG CCC ATC AAT CAC TCG GAC ATG GTG GAC AAG ATG TTT GGC TTC CTG GGG ACT TCG GGA GGC CTG CCA GGC CAG GAG GGA CAG GCA CCT AAA GGC TTC GAG GAC CTG GAG CGA GGG CGG AGG GAG ATG GTG GAG GAG GAC CTG GAC GCA GCC CTG CCC CTG CCC GAT GAG GAG GAG GAG GAC CTC TCC GAG TAC AAA TTT GCC AAG TTC GCT GCC ACC TAC TTC CAG GGC ACA ACC ACG CAC ACC TAC ACC CGG CGG CCG CTC AAG CAG CCG CTG CTC TAC CAC GAC GAC GAG GGC GAC CAG CTG GCG GCC CTG GCG GTC TGG ATC ACC GTC CTC CGT TTC ATG GGC GAT CTG CCC GAG CCC AAG TAC CAC ATG GCC ATG AGC GAC GGC AGC GAG AAG GTC CCA GTG ATG ACC AAG ATT TAC GAG ACC CTG GGC AAG AAG ACG TAC AAG AGA GAG CTG CAG GCC CTG CAG GGC GAG GGT GAG GCC CAG CTC CCC GAG GGA CAG AAG AAG AGC AGC ATG AGG CAC AAG CTG GTG CAC TTG ACC TTG AAG AAG AAG TCC AAA CTG ACG GAG GAG GTG ACC AAG AGG CTG AAC GAT GGG GAG TCC ACG ATG CAG GGC AAC AGC ATG CTG GAG GAC CGG CCC ACC TCC AAC CTG GAG AAG CTG CAC TTC GTC ATC GGC AAC GGC ATC CTG CGG CCG GCA CTG CGG GAT GAG ATC TAC TGC CAG ATC AGC AAG CAG CTC ACC CAC AAC CCC TCC AAG AGC AGC TAT GCC CGG GGC TGG ATC CTC ATG TCC CTC TGC GTG GGC TGC TTC TCC CCC TCA GAG AAG TTT GTT AAG TAC CTG CGG AAC TTC ATC CAT GGG GGG CCG CCT GGC TAC GCC CCA TAC TGT GAG GAG CGG CTG AGG AGG ACC TTC GTG AAC GGG ACA CGG ACA CAG CCG CCT AGC TGG CTG GAG CTG CAG GCC ACC AAG TCC AAG AAG CCT ATC ATG CTG CCC GTG ACG TTC ATG GAT GGC ACC ACC AAG ACT CTG CTG ACG GAC TCG GCC ACC ACC GCC AAG GAG CTC TGC CAC GCG CTG GCT GAC AAG ATC TCA CTC AAG GAC CGA TTC GGG TTC TCC CTC TAC ATT GCC CTG TTT GAT AAG GTC TCC TCC CTG GGC AGC AGC AGT GAC CAC GTC ATG GAC GCC ATC TCC CAG TGT GAG CAG TAC GCC AAG GAG CAG GGT GCC CAG GAA CGC AAT GCC CCC TGG AGG CTC TTC TTC CGC AAA GAG GTC TTT ACA CCC TGG CAC AAT CCC TCT GAA GAC AAC GTG GCC ACC AAC CTC ATC TAC CAG CAG GTG GTG CGC GGA GTC AAG TTT GGG GAG TAC AGG TGT GAG AAG GAG GAT GAT CTG GCT GAG CTG GCC TCC CAG CAG TAC TTT GTG GAC TAC GGC TCC GAG ATG ATC CTG GAG CGC CTC CTG AAC CTC GTG CCC ACC TAC ATC CCC GAC CGC GAG ATC ACA CCG CTG AAG ACA CTG GAG AAG TGG GCC CAG CTG GCC ATT GCC GCC CAC AAG AAG GGG ATC TAT GCC CAG AGG AGA GCT GAT GTC CAG AAG GTC AAA GAG GAC GTG GTC AAC TAT GCC CGC TTC AAG TGG CCC TTG CTC TTC TCC AGG TTT TAT GAG GCC TAC AAA TTC TCA GGG CCT AGC CTC CCC AAG AAC GAC GTC ATC GTG GCT GTC AAC TGG ACA GGC GTG TAC TTT GTG GAC GAG CAG GAG CAG GTG CTT CTG GAG CTC TCC TTC CCT GAA ATA ATG GCT GTC TCC AGC AGC AGG GGA GTG AAG CTG ATG GCC CCC AGC TTC ACG CTG GCC ACC ATC AAG GGG GAT GAG TAC ACC TTC ATG TCC GAC AAC GCC GAG GAT ATC CGT GAC CTG GTG GTC ACC TTC CTG GAG GGG CTC CGG AAG AGG TCG AAG TAT GTG GTG GCC CTG CAG GAC AAC CCC AAC CCT ACG GGC GAG GAG TCA GGT TTC CTG AGC TTC GCC AAG GGG GAC CTC ATC ATC CTG GAC CAC GAC ACG GGC GAG CAG GTC ATG AAC TCG GGC TGG GCC AAC GGC ATC AAC GAG AGG ACC AAG CAG CGT GGG GAC TTC CCC ACC GAT TGC GTG TAT GTC ATG CCC ACT GTC ACC AGG CCA CCG CGG GAG ATT GTG GCC CTG GTC ACT ATG ACC CCC GAT CAA AGG CAG GAC GTC ATC CGG CTC TTG CAG CTG CGA ACG GCG GAG CCC GAG GTG CGC GCA AAG CCG TAC ACA CTG GAG GAG TTC TCC TAC GAC TAC TTC AGG CCC CCG CCC AAG CAC ACG CTG AGC CGC GTG ATG GTG TCC AAG GCC CGC GGC AAG GAC CGG CTC TGG AGC CAC ACA CGG GAG CCG CTC AAG CAG GCA CTG CTC AAG AAG ATC CTG GGC AGC GAG GAG CTC TCG CAG GAG GCC TGC ATG GCC TTC ATC GCT GTG CTC AAG TAC ATG GGC GAC TAC CCG TCT AAG AGG ATG CGC TCT GTC AAC GAG CTC ACA GAC CAG ATC TTT GAG GGT GCC CTG AAG GCT GAG CCC CTC AAG GAC GAG GCG TAT GTG CAG ATC CTG AAG CAG CTG ACC GAC AAC AAC ATC AGG TAT AGC GAG GAG CGG GGC TGG GAG CTG CTC TGG CTG TGC ACG GGC CTC TTC CCA CCC AGC AAC GTC CTC CTG CCC CAT GTG CAG CGC TTC CTG CAG TCT CGC AAG CAC TTC CCA CTC GCC ATC GAC TGC CTG CAG CGG CTC CAG AAA GCC CTG AGA AAT GGG TCC CGA AAG TAT CCC CCA CAC CTG GTG GAG GTG GAG GCC ATC CAG CAC AAA ACC ACC CAG ATT TTC CAC AAG GTC TAC TTC CCT GAC GAC ACA GAT GAG GCC TTC GAG GTG GAG TCC AGC ACC AAG GCC AAG GAC TTC TGC CAG AAC ATC GCC GCC CGG CTG CTC CTC AAG TCC TCG GAG GGA TTC AGC CTC TTT GTC AAA ATC GCA GAC AAG GTC ATC AGT GTC CCT GAG AAT GAC TTC TTC TTT GAC TTT GTT CGA CAC CTG ACA GAC TGG ATA AAG AAA GCG CGG CCT GTC AAG GAT GGA ATC CTG CCC TCG CTC ACC TAC CAG GTG TTC TTC ATG AAG AAG CTG TGG ACC ACC ACG GTG CCA GGG AAG GAC CCC ATG GCT GAT TCC ATC TTC CAC TAT TAC CAG GAA TTG CCC AAG TAT CTC CGA GGC TAC CAC AAG TGT ACA CGA GAG GAG GTG CTA CAG CTG GGG GCA CTG ATC TAT AGG GTC AAG TTT GAA GAA GAC AAA TCC TAC TTC CCC AGT ATT CCC AAG CTG CTA AGG GAG CTG GTG CCC CAG GAC CTC ATC CGA CAG GTC TCA CCT GAC GAC TGG AAG CGG TCC ATC GTC GCC TAC TTC AAC AAG CAC GCA GGG AAA TCC AAG GAG GAG GCC AAG CTG GCC TTC CTG AAG CTC ATC TTC AAG TGG CCC ACA TTT GGT TCA GCC TTC TTT GAG GTG AAG CAA ACT ACA GAG CCA AAC TTC CCT GAG ATC CTC TTA ATT GCC ATC AAT AAG TAT GGG GTC AGC CTC ATT GAT CCT AGA ACC AAG GAC ATT CTG ACC ACT CAC CCC TTC ACC AAG ATC TCC AAC TGG AGC AGC GGC AAC ACC TAC TTC CAC ATC ACC ATT GGG AAC CTG GTG CGC GGG AGC AAA CTG CTC TGT GAG ACA TCA CTG GGC TAC AAG ATG GAT GAC CTC TTG ACG TCC TAC ATT AGC CAG ATG CTC ACA GCC ATG AGT AAA CAG CGG AGC TCC AGG AGT GGC AAA ,36.8
ATG GAC GAC CTC GAT GCC CTG CTG GCA GAC TTG GAA TCT ACC ACC TCC CAC ATC TCC AAA CGG CCA GTG TTC TTG TCA GAG GAG CCC CCC TAC TCC TAC CCA ACT GGA AAC CAC ACA TAC CAG GAG ATT GCG GTG CCA CCT CCG GTC CCA CCA CCA CCG TCC AGC GAG GCC CTC AAT GGC ACG GTC CTG GAC CCT TTA GAT CAG TGG CAG CCT AGT GGT TCC AGA TAC GCT CAC CAG CAG CCT CCG TCC CCA CTG CCC GTG TAC AGC TCC AGT GCT AAA AAT TCC AGT GCC TCC AAC ACC CAG GAC GGT GTG GGC TCC CTT TGT TCC CGA GCA GGC GAG GAA GAG CAC GTC TAC AGC TTC CCC AAC AAG CAG AAG TCG GCA GAG CCC TCA CCT ACC GTC ATG AGC TCC TCC CTG GGC AGC AAC CTC TCT GAA CTT GAC CGG CTG TTA CTG GAG CTG AAC GCG GTG CAG CAC AGC CCG CCT GGC TTC CCT GCA GAT GAA GCT GAA TCG AGC CCC CCC TTG CCT GGA GCC CTG AGC CCC CTT TAT GGC ATC CCA GAA AAT AAC ACT CCC TTG GGG GGC AAA GCG GGG CCC CTG GTG AAA GAG AAG CCA AAG CGA AAT GGA GGC CGG GGG CTG GAG GAT GTG CGG CCC AGC GTG GAG AGC CTC TTG GAT GAA CTG GAG AGT TCC GTG CCC AGC CCT GTC CCG GCC ATC ACT GTG AAC CAG GGA GAG ATG AGC AGT CCG CAG CGA GTC ACC TCC AGC CAG CAG CAG ACC CGG ATC TCG GCC TCC TCT GCC ACC AGG GAG CTG GAC GAG CTC ATG GCG TCA CTG TCA GAT TTC AAG TTC ATG GCC CAG GGG AAA ACT GGG AGC AGC TCA CCC CCT GGG GGG CTC TCC AAG CCC GGG AGC CAG CTG GAC AGC ATG TTG GGG AGT CTG CAG TCC GAC CTG AAC AAG CTA GGG GTC GCC ACC GTT GCC AAA GGG GTC TGT GGA GCC TGC AAG AAG CCC ATC GCT GGG CAG GTC GTG ACC GCC ATG GGG AAG ACA TGG CAC CCC GAG CAC TTT GTG TGC ACC CAC TGC CAG GAG GAG ATT GGA TCC CGA AAC TTT TTT GAG CGG GAC GGA CAG CCC TAC TGT GAG AAG GAC TAC CAC AGC CTC TTC TCC CCA CGC TGC TAC TAC TGC AAC GGA CCC ATC CTG GAT AAA GTG GTG ACA GCG CTG GAC CGC ACG TGG CAC CCG GAA CAC TTC TTC TGT GCC CAG TGT GGA GCC TTC TTT GGT CCA GAA GGC TTC CAC GAG AAG GAC GGC AAA GCG TAC TGT CGT AAA GAT TAC TTC GAC ATG TTT GCT CCC AAG TGC GGT GGC TGC GCC CGT GCC ATC CTG GAG AAC TAC ATT TCA GCC CTC AAC ACT CTC TGG CAC CCC GAA TGC TTT GTG TGC AGG GAG TGC TTC ACA CCC TTC GTC AAC GGC AGC TTC TTT GAG CAC GAC GGG CAG CCG TAC TGT GAG GTC CAC TAC CAC GAG CGG CGC GGC TCG CTG TGC TCC GGC TGC CAG AAG CCC ATC ACG GGC CGC TGC ATC ACC GCC ATG GCC AAG AAG TTC CAC CCC GAG CAT TTC GTG TGC GCC TTT TGC CTG AAG CAG CTC AAC AAG GGC ACC TTC AAG GAG CAG AAT GAC AAA CCC TAC TGC CAG AGC TGC TTC CTG AAG CTC TTC TGC ,3.5
ATG GAC TCA ACC CTA ACA GCA AGT GAA ATC CGG CAG CGT TTT ATA GAT TTC TTC AAG AGA AAT GAA CAC ACC TAT GTT CAC TCA TCT GCC ACC ATC CCT TTG GAT GAT CCC ACT TTG CTC TTT GCC AAT GCA GGC ATG AAC CAG TTC AAA CCC ATC TTT CTG AAT ACT GTT GAC CCA TCT CAC CCT ATG GCA AAG CTG AGC AGA GCT GCC AAT ACC CAG AAA TGC ATC CGG GCT GGG GGC AAA CAC AAT GAC CTG GAC GAT GTG GGC AAG GAT GTC TAT CAT CAC ACC TTC TTT GAG ATG TTG GGC TCC TGG TCT TTT GGA GAT TAC TTC AAG GAA TTG GCA TGT AAG ATG GCT CTA GAA CTT CTC ACC CAA GAG TTT GGC ATT CCA GTT GAA AGA CTC TAC GTT ACT TAC TTT GGG GGG GAT GAA GCA GCC AGC TTA GAA CCA GAC CTG GAG TGC AAA CAG ATC TGG CAC AAC TTG GGG CTG GAT GAC AGC AAA ATC CTC CCA GGC AAC ATG AAG GAT AAC TTC TGG GAG ATG GGT GAC ACG GGC CCT TGT GGT CCC TGC AGT GAG ATC CAC TAT GAC CGG ATT GGT GGT CGG GAT GCG GCG CAC CTC GTC AAC CAG GAT GAC CCC AAT GTG CTA GAG ATC TGG AAC CTC GTG TTC ATC CAG TAT AAC AGG GAA ACC GAT GGC ATT CTG AAA CCT CTT CCC AAG AAA AGC ATT GAC ACA GGG ATG GGC CTG GAG CGA TTA GTG TCT GTG CTG CAG AAT AAA ATG TCC AAC TAT GAC ACT GAC CTT TTT GTC CCT TAC TTT GAA GCC ATT CAG AAG GGC ACA GGT GCG CGG CCA TAC ACT GGG AAG GTT GGT GCT GAT GAT GCT GAT GGG ATC GAC ATG GCC TAC CGG GTG CTG GCC GAC CAC GCT CGG ACC ATC ACC GTG GCC CTG GCT GAT GGT GGC CGA CCT GAC AAC ACA GGG CGG GGG TAT GTG TTG AGA CGG ATT CTC CGC CGG GCT GTT CGA TAC TCC CAT GAG AAA CTC AAC GCC AGC AGG GGT TTC TTT GCT ACA TTA GCA GAT GTT GTT GTG CAG TCC CTG GGA GAT GCA TTT CCT GAG CTA AAG AAG GAC CCA GAT ATG GTG AAG GAC ATC ATT AAT GAA GAA GAA GTG CAA TTT CTC AAG ACG CTC AGC AGA GGG CGT CGC ATC CTG GAC AGG AAA ATT CAG AGC CTG GGA GAC AGC AAA ACC ATT CCC GGG GAC ACT GCT TGG CTC CTC TAT GAC ACC TAT GGG TTT CCA GTG GAT CTT ACT GGA CTG ATT GCT GAA GAG AAG GGC CTG GTG GTA GAT ATG GAT GGC TTT GAA GAG GAG AGG AAG CTG GCT CAG CTG AAA TCA CAG GGC AAG GGA GCT GGT GGG GAA GAC CTC ATT ATG CTG GAC ATT TAT GCT ATT GAA GAG CTC CGA GAA AAG GGT CTG GAG GCA ACA GAT GAT TCC CCA AAG TAT AAT TAC CAT TCG GAC TCC AGT GGG AGC TAC GTG TTT GAG AGT GCA GTG GCT ACA GTG ATG GCT CTG CGC AGG GAC AAG ATG TTT GTG GAG GAA GTG TCC ACG GGC CAG GAG TGT GGA GTG GTG CTG GAC AAG ACC TGT TTC TAT GCT GAG CAA GGA GGG CAG ATC TAC GAC GAA GGC TAC CTG GTG AAG AAA ACT GAG TTT ACG GTG AAG AAC GCT CAG GTC CGA GGA GGG TAT GTC CTG CAC GTA GGA ACA ATC TAT GGC AGC CTG AAA GTG GGG GAT CAG GTC CGG CTG TTT ATT GAT GAG CCC CGA CGG AGG CCT GTC ATG AGC AAC CAC ACA GCC ACC CAC ATC CTG AAC TTC GCC CTG CGT TCC GTG CTT GGG GAG GCT GAC CAG AGA GGC TCC CTG GTT GCT CCT GAC CGC CTT CGG TTT GAC TTC ACC GCC AAG GGA GCC ATG TCC ACC CAA CAG ATC AAG AAG GCC GAG GAG ATT GCA AAC GAG ATG ATT GAA GCA GCC AAG CCC GTC TAC ACC CAG GAT TGT CCT CTG GCA GCA GCT AAA GCC ATC CAG GGC CTG CGG GCT GTG TTT GAT GAG ACC TAT CCT GAC CCT GTG CGA GTC GTC TCT ATT GGG GTC CCG GTG TCT GAG CTG TTG GAT GAC CCC TCC GGT CCT GCT GGC TCG CTC ACT TCT GTT GAG TTC TGT GGG GGA ACG CAT CTG CAG AAT TCG AGT CAC GCG GGA GCT TTT GTG ATT GTG AGT GAA GAA GCT ATT GCC AAG GGC ATC CGG AGG ATT GTT GCT GTC ACA GGT GCC GAA GCC CAG AAG GCG CTC AGG AAA GCA GAG AGC TTG AAG AAA TCT CTT TCT GTC GCG GAG GCC AAA GTG AAG GCC CAG ACT GCG CCA AAT AAG GAC GTG CAG AGG GAG ATC GCG GAC CTT GGT GAG GCT CTG GCC ACC GCA GTC ATC CCT CAG TGG CAG AAG GAT GAA TTC CGG GAG AAT CTC AAA TCC CTG AAG AAA ATC ATG GAT GAC CTA GAC CGG GCT AAC AAA GCC GAT GTC CAG AAG CGG GTG CTG GAG AAG ACA AAG CAG CTC ATT GAC AGC AGC CCC AAC CAG CCC CTT GTC ATC CTG GAG ATG GAG AGC GGC GCC TCG GCC AAG GCC CTG AAC GAA GCC TTG AAG CTC TTC AAG ACG CAT TCC CCT GAG ACG TCT GCC ATG CTC TTC ACA GTG GAT AAT GAG GCT GGC AAG ATC ACA TGC TTG TGT CAA GTC CCC CAG AAT GCA GCC AAC CGG GGC CTG AAA GCC AGC GAG TGG GTG CAA CAG GTG TCA GGT CTG ATG GAT GGC AAA GGT GGT GGC AAA GAT GTG TCC GCT CAG GCC ACA GGC AAG AAC GTG GGC TGC CTG CAG GAG GCG CTG CAG CTG GCC GCC ACC TTT GCC CAG CTC CAC CTG GGA GAT GTG AAG AAC ,47.0
