ATG CTT TTC AAT TCG GTG CTC CGC CAG CCC CAG TTC GGC GTC CCG AGA AAT GCT CCC AAT ATG GAG CAT ATA CTA GCA GTT GCC AAT GAA GAA GGC TTC GTT AGG TTA TAT AAC ACA GAA TCA CAA GCC AAT CGA AAG AAG TGT GTC AAA GAA TGG ATG GCT CAC TGG AAT GCT GTC TTT GAT CTG GCC TGG GTT CCT GGT GAA CTT AAG CTT GTT ACA GCA GCA GGT GAT CAA ACA GCC AAA TTT TGG GAT GTA AAA GCT GGT GAG CTG ATT GGA ACA TGC AAA GGT CAT CAG TGC AGC CTC AAA TCA GTT GCC TTT TCT AAG TTT GAG AAA GCC GTC TTC TGT ACA GGT GGA AGA GAT GGC AAC ATT ATG GTC TGG GAC ACC AGG TGC AAC AAA AAA GAT GGA TTT TAT AGG CAA GTG AAT CAA ATC AGT GGA GCT CAC AAT ACC TTA GAC AAG CAA ACC CCT TCA AAA CCT AAG AAG AAA CAG AAT TCA AAA GGA CTT GCT CCT TCT GTG GAT TTC CAG CAG AGT GTT ACT GTG GTC CTC TTT CAA GAT GAG AAT ACA TTA GTC TCG GCG GGA GCT GTG GAT GGG GTA ATC AAA ATA TGG GAT TTA CGG AAG AAT TAT ACT GCT TAT CGA CAG GAA CCC ATA GCA TCC AAG TCT TTT CTG TAC CCA GGT AGC AGC ACT CGA AAA CTA GGA TAC TCA AGT CTG ATT TTG GAT TCC ACG GGC TCT ACT TTA TTT GCT AAC TGC ACA GAT GAC AAC ATC TAC ATG TTC AAT ATG ACT GGA TTA AAG ACT TCT CCA GTG GCT ATC TTC AAT GGA CAT CAA AAC TCT ACC TTC TAT GTT AAA TCC AGT CTT AGT CCA GAT GAC CAG TTT TTA GTC AGT GGC TCA AGT GAT GAA GCT GCC TAT ATC TGG AAG GTC TCC ACA CCC TGG CAT CCT CCT ACG GTA CTC CAG GGT CAC TCT CAA GAG GTC ACA TCT GTG TGC TGG TGT CCA TCA GAC TTC ACA AAG ATT GCT ACC TGC TCT GAT GAC AAT ACA CTG AAA ATC TGG CGT TTG AAT AGA GGC TTA GAG GAG AAA TCA GGA GGA GAT AAG CTC TCC ATA GTG GGT TGG GCA TCT CAG AAG AAA AAA GAG GCG AGA GCT GAC CTA GTA ACA GTG ACA AGT AGC CAG AGC ACT CCT GCC AAA GCC CCC AGA GTA AAG AGC AGT CCA TCT ATT TCT TCC CCA TCA TCA GCA GCT TGT GCT CCA AGC TGT GCA GGA GAC CTC CCT CTT CCT TCA AAT ACT CCC ACA TTC TCT ATT AAA ACC CCT CCT GCC AAA GCC CGG TCT CCC ATC AGC AGA AGA GGC TCT GTG TCC TCG GTC TCT CCC AAG CCA CCC TCG TCT TTC AAG ATG TCC ATT AGA AAC TGG ATG ACC CGA ACA CCA TCC TCC TCA CCA CCC ATC ACG CCA CCT GCT TCT GAA AGC AAG ATC ACT TCT CCA AGA AAA GCC CTC ATT CCT GTG AGC CTA AAA TCA TCC CAA GCA GTG GCT TGC TCT GAG TCC AGA AAT CGA GTC AAG AGG AGG CTG GAC TCA AGT TGT CTG GAG AGT GTG AAA CAG AAG TGT GTG AAG AGT TGC AAC TGT GTG ACT GAG CTT GAT GAC CCA GTT GAA AAG CTT CAT TTG GAT CTG TGC TGC CTT GCT GGT AGC CAG GAA GAC CTT GGT AAG GAC TCT CTA GGT CCT CCC AAA CCA AGC AAG ATT GAA GGA GCT AGT ATG AGT ATC TCA GAG CCT CCT TCT CCC GCC AGT CCT TAT GCT TCA GAA AGC TGC GGA ACA CTA CCT CTT CCT TTG GGA TCT TGT GGA GAA GGG TCT GAG GTG GTA GGC AAA GAG AAT AGC TCC CCG GAG AAT AAA AAC TGG TTA TTG GCC ATG GCG GCC AAA CGG AAG GCT GAG AAT TCA TCT CCC CGA AGT CCA TCC TCC CAG ACC CCC AAT TCT AGG AGA CAG AGT GGA AAG ACT TCT CCA GGC CCG GTC ACT ATT ACT CCC AGC TCC ATG AGG AAA ATC TGT ACA TAC TTC CAT AGA AAA TCT CAA GAT GAC TAC TGT AGT CCC GAA CAG TCA ACA GAA TTA ,26.8
ATG GAG CCG CGG GAC GGC AGC CCC GAG GCC CGG AGC AGC GAC TCC GAG TCG GCC TCC GCC TCG TCC AGC GGC TCC GAG CGC GAC GCG GGT CCC GAG CCG GAC AAG GCG CCG CGG CGT CTC AGC AAG CGG CGC TTC CCA GGG CTG CGG CTC TTC GGG CAC AGG AAA GCC ATC ACC AAG TCG GGC CTC CAG CAC CTG GCA CCC CCT CCT CCT GCT CCC GGG GCC CCG TGC GGC GAG CCT GAG CGG CAG ATC CGG AGC ACC GTG GAC TGG AGT GAG TCG GCC ACG TAT GGG GAA CAC ATT TGG TTC GAG ACC AAC GTG TCC GGG GAC TTC TGC TAC GTC GGA GAG CAG TAC TGC GTC GCC AAG ATG CTG CAG AAA TCA GTG TCC CGG AGA AAG TGT GCG GCC TGC AAG ATT GTG GTC CAC ACG CCC TGC ATC GAG CAG CTC GAG AAG ATA AAT TTC CGC TGT AAG CCA TCC TTC CGT GAA TCG GGC TCC AGG AAC GTC CGT GAG CCA ACC TTC GTG CGG CAC CAC TGG GTC CAC CGA CGA CGC CAG GAT GGC AAG TGT CGG CAC TGC GGG AAG GGC TTC CAG CAG AAG TTC ACC TTC CAC AGC AAA GAG ATC GTG GCC ATC AGC TGC TCC TGG TGC AAG CAA GCA TAC CAC AGC AAG GTG TCC TGC TTC ATG CTG CAG CAG ATC GAG GAG CCA TGC TCC CTG GGG GTC CAT GCC GCC GTG GTC ATC CCC CCC ACC TGG ATA CTC CGG GCC CGT AGG CCC CAG AAC ACC CTC AAA GCC AGC AAG AAG AAA AAG AGA GCA TCC TTC AAG AGG AAG TCG AGC AAG AAA GGG CCT GAG GAG GGC CGC TGG AGA CCC TTC ATC ATC AGG CCC ACC CCG TCC CCC CTC ATG AAG CCC CTG CTG GTC TTT GTG AAC CCC AAG AGT GGG GGC AAC CAG GGC GCC AAG ATC ATA CAG TCC TTC CTC TGG TAT CTG AAT CCC CGG CAA GTC TTT GAC CTG AGC CAG GGA GGA CCC AGG GAG GCG CTG GAG ATG TAC CGC CGG GTG CAC AAC CTG CGG ATC CTG GCC TGC GGG GGC GAC GGC ACG GTT GGC TGG ATC CTC TCT ACC CTG GAC CAG CTG CGC TTG AAG CCG CCA CCG CCG GTC GCC ATC CTG CCC CTG GGC ACT GGC AAT GAC TTG GCT CGC ACC CTC AAC TGG GGC GGG GGC TAC ACT GAC GAG CCT GTG TCC AAG ATC CTG TCC CAC GTG GAG GAG GGC AAC GTG GTG CAG CTG GAC CGC TGG GAC CTC CGT GCG GAG CCC AAC CCT GAG GCA GGC CCC GAG GAG CGA GAC GAG GGG GCC ACC GAC CGG CTG CCT CTG GAT GTT TTC AAC AAC TAC TTC AGC CTG GGC TTT GAC GCC CAC GTC ACC CTG GAG TTC CAC GAG TCT CGA GAG GCC AAC CCG GAG AAG TTC AAC AGC CGC TTT CGG AAT AAG ATG TTC TAC GCC GGG ACA GCC TTC TCC GAC TTC CTG ATG GGC AGC TCC AAG GAC TTG GCC AAG CAC ATC CGC GTG GTG TGT GAT GGG ACT GAC CTG ACC CCC AAG ATT CAG GAC CTG AAA CCC CAG TGC ATT GTT TTC CTG AAC ATC CCC AGG TAC TGC GCG GGC ACC ATG CCC TGG GGC CAC CCT GGG GAG CAC CAT GAC TTT GAG CCC CAG CGG CAC GAC GAC GGC TAC CTC GAG GTC ATC GGC TTT ACC ATG ACC TCC CTG GCC GCG CTG CAG GTG GGC GGG CAT GGC GAG CGG CTG ACG CAG TGC CGA GAG GTG CTG CTC ACC ACG TGC AAA GCC ATC CCG GTG CAG GTG GAC GGC GAG CCC TGC AAG CTC GCC GCC TCC CGC ATC CGC ATC GCC CTG CGC AAC CAA GCC ACC ATG GTG CAG AAG GCC AAG CGG CGG AGC GCC GCC CCC CTG CAC AGC GAC CAG CAG CCG GTG CCG GAG CAG CTG CGA GTC CAG GTG AGC AGG GTC AGC ATG CAC GAC TAC GAG GCC CTG CAC TAT GAC AAG GAG CAG CTC AAA GAG GCT TCC GTG CCG CTG GGC ACC GTG GTG GTT CCG GGA GAC AGC GAC CTG GAG CTG TGC CGC GCC CAC ATT GAG AGG CTC CGG CAG GAA CCC GAA GGT GCT GGA GCC AAG TCC CCG ATG TGC CAG AAA CTG TCC CCC AAG TGG TGC TTC CTC GAT GCC ACC ACT GCC AGC CGC TTC TAC AGA ATC GAC AGG GCC CAG GAA CAC CTC AAC TAC GTG ACC GAG ATC GCG CAA GAC GAG ATT TAT ATC CTG GAC CCT GAG CTG CTG GGG GCA TCT GCC CGG CCT GAC CTC CCC ACC CCC ACG TCC CCT CTC CCC ACG TCG CCC TGC TCC CCC ACA TCC CGG TCA CTG CCA GGG AAC GCT GCG CCC CCT ACA GGT GAA GAG CTC ATC GAG GCT GCC AAG AGG AAC GAT TTC TGT AAG CTC CAG GAG CTG CAC CGA GCT GGG GGC GAC CTC ATG CAC CGT GAC GAG CGG AGC CGC ACA CTC CTG CAC CAC GCG GTC AGC ACC GGC AGC AAG GAA GTG GTC CGC TAC CTG CTG GAC CAT GCG CCC ACT GAG ATC CTT GAT GCC GTG GAG GAA AAC GGG GAG ACC TGC CTG CAC CAG GCA GCG GCC CTG GGC CAG CGC ACC ATC TGC CAC TAC ATC GTG GAG GCC GGG GCC TCG CTC ATG AAG ACC GAC CAG CAG GGC GAC ACT CCC CGG CAG AGG GCT GAG AAG GCT CAG GAC ACG GAA CTG GCC GCG TAC CTG GAG AAC CGG CAG CAT TAC CAG ATG ATC CAG CGG GAG GAC CAG GAG ACG GCG GTG ,39.5
ATG AAT GTG AAC ATC CCA CAG TTG GCA GAC AGT TTG TTT GAA AGA ACT ACT AAT AGT AGT TGG GTA GTG GTC TTC AAA TCA CTC ATA ACA ACT CAT CAT TTG ATG GTG TAT GGA AAT GAG CGT TTC ATT CAG TAT TTG GCT TCA AGA AAC ACA TTG TTT AAC TTA AGC AAT TTT TTG GAT AAA AGT GGA TTG CAA GGA TAT GAT ATG TCT ACA TTT ATT AGA CGG TAT AGT AGA TAC TTA AAT GAA AAG GCA GTT TCA TAC AGA CAA GTT GCA TTC GAT TTC ACA AAA GTA AAG AGA GGA GCT GAT GGA GTT ATG AGA ACA ATG AAC ACA GAA AAA CTG TTA AAA ACT GTA CCA ATT ATC CAA AAT CAA ATG GAT GCA CTT CTT GAT TTT AAT GTT AAT AGT AAT GAA CTT ACA AAT GGG GTA ATA AAT GCT GCC TTC ATG CTC CTG TTC AAA GAT GCC ATT AGA CTA TTT GCA GCA TAC AAT GAA GGA ATT ATT AAC TTA TTG GAA AAA TAT TTT GAT ATG AAA AAG AAC CAG TGC AAA GAA GGT CTT GAC ATC TAT AAG AAG TTT CTG ACT AGG ATG ACA AGA ATC TCA GAG TTT CTG AAA GTT GCA GAG CAA GTT GGA ATT GAC AGA GGA GAT ATT CCA GAT CTT TCA CAG GCC CCC AGC AGT CTT CTT GAT GCT TTA GAA CAA CAT TTA GCT TCC TTG GAA GGG AAG AAA ATC AAA GAT TCC ACA GCT GCA AGC AGG GCT ACC ACA CTT TCC AAT GCA GTC TCT TCT TTA GCA AGC ACT GGC CTG TCT CTG ACC AAA GTG GAT GAA AGG GAA AAG CAG GCA GCA TTA GAG GAA GAA CAG GCT CGT TTA AAA GCA CTA AAG GAA CAG CGT CTA AAA GAA CTT GCA AAG AAA CCG CAT ACC TCT TTA ACA ACT GCA GCC TCT CCT GTG TCC ACC TCA GCA GGG GGA ATA ATG ACT GCA CCA GCC ATT GAC ATA TTT TCT ACC CCT AGT TCT TCT AAC AGC ACA TCT AAG CTG CCA AAT GAC CTG CTT GAT CTG CAG CAG CCA ACT TTT CAT CCA TCT GTC CAT GCT ATG TCA GCT GCT CCT CAG GTA GCA AGC ACA TGG GGA GGA TTC AGT CCT TCT CCA GTT GCA CAG CCA CAT CCT TCA GCT GGC CTT AAT GTC GAC TTT GAA TCT GTG TTT GGG AAT AAG TCT ACA AAT GTT GCT GTA GAT TCT GGT GGC TTT GAT GAA CTA GGT GGA CTT CTC AAA CCA ACA GTG GCC TCT CAG AAC CAG AGT CTT CCT ATT GCC AAG CTT CCG CCT AAC AAA TTA GTG TCT GAT GAC CTG GAT TCA TCT TTA GCC AAC CTT GTG GGC AAT CTT GGC ATT GGA AAT GGA ACC ACT AAG AAT GAT GTA AGT TGG AGT CAG CCA GGT GAA AAG AAG TTA ACT GGA GGA TCT AAC TGG CAA CCA AAG GTT GCA CCA ACA ACT GCC TGG AGT GCT GCG ACA ATG GCA CCC CCT GTA ATG GCC TAT CCT GCT ACG ACA CCA ACG GGC ATG ATA GGA TAT GGA ATT CCT CCT CAG ATG GGA AGT GTG CCT GTA ATG ACA CAA CCA ACC TTA ATA TAC AGC CAG CCT GTC ATG AGA CCA CCC AAC CCC TTT GGC CCT GTA TCA GGA GCA CAG ATA CAG TTT ATG ,6.7
ATG GCA CCT GGT CCC GTC TTC TTC TAC ATC TTA ATT ATT GGA AAA TAT TTT TCT CAT GGG GGT GGA CAG GAT GTC AAG TGC TCC CTT GGC TAC TTC CCC TGT GGG AAT GCC ACG AAG TGC TTG CCT CAG CTG CTG CAC TGT AAC GGT GTG GAC GAC TGC GGG AAT CAG GCC GAT GAG GAC GAC TGT GGA GAC AAC AAT GGA TGG TCT CTG CAA TTT GAC AAA TAT TTT GCC AGT TAC TTC AAA ATG ACT TCC CCA TAT CCC TTT GAG GCA GAA AAA CCA GAA TGT TTG GTC GGT TCT GTG CCA CTG CAA TGT CAT TGC CAA GGT CTG GAG CTT GAC TGT GAT GAA ACT AAT TTA CGA GCT GTT CCA TCA GTT TCT TCA AAT GTG ACT GCA ATG TCA CTT CAG TGG AAC TTA ATA AGA AAG CTT CCT CCT GAT TGC TTC AAG AAT TAT CAC GAT CTT CAG AAG TTG TAC CTG CAA AAC AAT AAG ATT ACA TCC ATC TCC ATC TAT GCT TTC AGA GGA CTG AAA AGC CTC ACT AAA CTG TAT CTC AGT CAT AAC AGA ATA ACC TTC CTG AAG CCG GGT GTT TTT GAA GAT CTT CAC AGA CTA GAA TGG CTG ATA ATT GAA GAT AAT CAC CTC AGT CAA ATT TCC CCA CCA ACA TTT TAT GGA CTA AAT TCT CTT ATT CTC TTA GTC CTG ATG AAT AAT GTC CTC ACC CAT TTA CCT GAT AAG CTT CTC TGT CAA CAC ATG CCA AGA CTA CAC TGG CTG GAC TTT GAA GGC AAC CAT ATC CAA AAT TTA GGA AAT TTG ACT TTT ATT TCC TGC AGT AAT TTA ACT GTT TTA GTG ATG AGG AAA AAC AAA ATT AAT CAC TTA AAT GAA AAT ACT TTT GCG CCT CTC CAG AAA CTG GAT GAA TTC AGC CTA GAA GGG ATT GAA ATT TCA AAT ATC CAA CAA AGG ATG TTT AGA CCT CTT ATG AAT CTC TCT CAC ATA TAT TTT AAG AAA TTC CAG TAC TGT GGG TAT GCA CCA CAT GTT CGC AGC TGT AAA CCA AAC ACT GAT GGA ATT TCA TCT CTA GAG AAT CTC TTG GCA AGC ATT ATT CAG AGA GTA TTT GTC TGG GTT GTA TCT GCA GTT ACC TGC TTT GGA AAC ATT TTT GTA ATT TGC ATG CGA CTT TAT ATC AGG TCT GAG AAC AAG CTG CAT GCC ATG TCA ATC ATT TCT CTC TGC TGT GCC GAC TGC TTA ATG GGA ATA TAT TTA TTC GTG ATC GGA GGC TTT GAC CTA AAG TTT CGT GGA GAA TAC AAT AAG CAT GCG CAG CTG TGG ATG GAG AGT ACT CAT TGT CAG CTT GTA GGA TCT TTG GCC ATT CTG TCC ACA GAA GTA TCA GTC TTA CTG TTA ACA TTT CTG ACA TTG GAA AAA TAC ATC TGC ATT GTC TAT CCT TTT AGA TGT TTG AGA CCT GGA AAA TCC AGA ACA ATT ACA GTT CTG ATT CTC ATT TGG ATT ATT GGG TTT ATA GTG GCT TTC ATT CCA CTG AGC AAT AAG GAA TTT TTC AAA AAC TAC TAT GGC ACC AAT GGA GTA TGC TTC CCT CTA CAT TCG GAA CAT ACA GAA AGT ATT GGA GGC CAG ATT TAT TCA GTG GCG ATT TTT CTT GGT ATT AAT TTG GCC GCA TTT ATC ATC ATA ATT TTT TCC TAT GCA AGC ATG TTT TAT AGT GTT CAT CAA AGT ACC ATA ACA GCA ACT GAA ATA CGG AAT CAA GTT AAA AAA GAG ATG ATC CTT GCC AAA CGG TTT TTC TTT ATA GTG TTT ACT GAT GCA TTA TGC TGG ATA CCC GTT TTT GTT CTG AAA TTT CTT TCA CTG CTT CAG GTA GAA ATA CCA GGT ACC ATA ACC TCT TGG GTA GTG ATT TTT ATT CTG CCC ATC AAC AGT GCT TTG AAC CCA ATT CTC TAT ACT CTG ACC ACA AGA CCA TTC AAG GAA ATG ATT CAT CAG TTT TGG TAT AAC TAC AGA CGA AGA AAG TCT AGG GAC AGC AAA GTT CAG AAA ACA TAT GCT CCA TCA TTC ATC TGG GTG GAA ATG TGG CCA CTG CAG GAA ATG CCA CCT GAG TTA ATG AAG CCG GCC GTT TTC ACA  GAC CCC TGT GAA ATG TCG CAG ATT TCT CAA TCA ACT AGG CTC AGT TCC TAT TCA ,54.0
ATG CAT CAC CAA CAG CGA ATG GCT GCC TTA GGG ACG GAC AAA GAG CTG AGT GAT TTA CTG GAT TTC AGT GCG ATG TTT TCA CCT CCT GTG AGC AGT GGG AAA AAT GGA CCA ACT TCT TTG GCG AGT GGA CAT TTC ACT GGC TCA AAT GTA GAA GAC AGA AGT AGC TCA GGG TCC TGG GGG AAC GGA GGA CAT CCA AGC CCG TCC AGG AAC TAT GGA GAT GGG ACT CCC TAT GAC CAC ATG ACC AGC AGG GAC CTT GGG TCA CAT GAC AAT CTC TCT CCA CCT TTT GTC AAT TCC AGA ATA CAA AGT AAA ACA GAA AGG GGC TCA TAC TCA TCT TAT GGG AGA GAA TCA AAC TTA CAG GGT TGC CAC CAG CAG AGT CTC CTT GGA GGT GAC ATG GAT ATG GGC ACC CCA GGA ACC CTG TCG CCC ACC AAA CCT GGC TCC CAG TAT TAC CAG TAT TCT AGC AAT AAC CCC CGA AGG AGG CCT CTT CAC AGT AGT GCT ATG GAG GTG CAG ACA AAG AAA GTT CGA AAA GTT CCT CCA GGT TTG CCA TCT TCA GTT TAT GCT CCA TCA GCA AGC ACT GCC GAC TAC AAT AGG GAC TCG CCA GGC TAC CCT TCC TCG AAA CCA GCA GCC AGC ACT TTC CCT AGC TCC TTC TTC ATG CAG GAT GGC CAT CAC AGC AGT GAC CCT TGG AGC TCC TCC AGT GGG ATG AAT CAG CCT GGC TAC GGA GGA ATG TTG GGC AGT TCT TCT CAT ATT CCA CAG TCT AGC AGC TAC TGT AGC CTG CAT CCA CAC GAA CGC TTG AGC TAT CCA TCA CAC TCC TCA GCA GAC ATC AAT TCC AGT CTT CCT CCG ATG TCC ACT TTC CAC CGT AGT GGC ACA AAC CAT TAC AGC ACC TCT TCC TGT ACA CCT CCT GCC AAC GGG ACA GAC AGT ATA ATG GCA AAT AGA GGA AGC GGG GCA GCA GGC AGC TCC CAG ACT GGA GAT GCT CTG GGG AAA GCA CTT GCT TCG ATC TAT TCT CCA GAT CAC ACT AAC AAC AGC TTT TCA TCA AAC CCT TCA ACT CCT GTT GGC TCT CCT CCT TCT CTC TCA GCA GGC ACA GCT GTT TGG TCT AGA AAC GGA GGA CAG GCC TCA TCA TCT CCT AAT TAT GAA GGA CCC TTA CAC TCT TTG CAA AGC CGA ATT GAA GAT CGC TTA GAA AGA CTG GAT GAT GCT ATT CAC GTT CTC CGG AAT CAT GCA GTG GGC CCA TCC ACA GCT ATG CCG GGT GGT CAT GGG GAC ATG CAT GGA ATC ATT GGA CCT TCT CAT AAT GGA GCG ATG GGT GGT CTG GGC TCA GGG TAT GGA ACC GGT CTT CTT TCA GCC AAC AGA CAT TCA CTC ATG GTC GGG GCC CAT CGC GAA GAC GGC GTG GCC CTG CGA GGC AGC CAC TCC CTC GTG CCC AAC CAG GTC CCG GTG CCA CAG CTT CCT GTG CAG TCT GCG ACG TCC CCT GAC CTG AAC CCA CCC CAG GAC CCT TAC AGA GGC ATG CCA CCG GGA TTG CAG GGC CAG AGC GTC TCC TCC GGC AGC TCT GAG ATC AAA TCC GAC GAT GAA GGC GAT GAG AAC CTG CAA GAC ACG AAA TCT TCC GAG GAC AAG AAG TTA GAT GAC GAC AAG AAG GAT ATC AAA TCG ATT ACT AGG TCA AGA TCT AGC AAT AAC GAT GAC GAG GAC CTG ACC CCG GAG CAG AAG GCA GAG CGC GAG AAG GAG CGG AGG ATG GCC AAC AAC GCC CGC GAG CGC CTG CGC GTC CGC GAC ATC AAC GAG GCT TTC AAG GAG CTC GGC CGC ATG GTG CAG CTC CAC CTC AAG AGT GAC AAG CCC CAG ACC AAG CTC CTG ATC CTC CAC CAG GCC GTG GCC GTC ATC CTC AGC CTG GAG CAG CAA GTT CGA GAA AGG AAT CTG AAT CCG AAA GCC GCG TGT CTG AAA AGA AGG GAG GAA GAG AAG GTG TCC TCA GAG CCT CCC CCT CTC TCC TTG GCG GGC CCG CAC CCT GGA ATG GGA GAT GCG TCA AAC CAC ATG GGA CAG ATG ,21.3
ATG GCT TCT GGA GCC GAT TCA AAG GGT GAT GAC TTA TCA ACA GCC ATT CTC AAA CAG AAG AAC CGT CCC AAT CGG TTG ATT GTT GAT GAA GCC ATC AAT GAG GAC AAC AGT GTG GTA TCC TTG TCC CAG CCC AAG ATG GAT GAA CTG CAG TTG TTC CGA GGT GAC ACA GTG TTG CTG AAA GGA AAG AAG AGG CGG GAA GCT GTG TGC ATT GTG CTT TCT GAT GAC ACA TGT TCT GAT GAG AAG ATT CGA ATG AAT AGA GTT GTT CGG AAT AAC CTT CGT GTA CGC CTA GGG GAT GTC ATC AGC ATC CAG CCA TGC CCT GAT GTG AAG TAC GGC AAA CGT ATC CAT GTG CTA CCC ATC GAT GAC ACA GTG GAA GGC ATC ACT GGC AAT CTC TTT GAG GTA TAC CTT AAG CCG TAC TTC CTG GAA GCT TAT CGA CCC ATC CGG AAA GGG GAC ATT TTC CTT GTC CGT GGT GGG ATG CGT GCT GTG GAG TTC AAA GTA GTG GAG ACA GAT CCC AGC CCT TAT TGT ATT GTT GCT CCA GAC ACA GTG ATC CAC TGT GAA GGA GAG CCT ATC AAA CGA GAG GAT GAG GAA GAG TCC TTG AAT GAA GTA GGC TAT GAT GAC ATT GGT GGC TGT AGG AAG CAA CTA GCT CAG ATA AAG GAG ATG GTG GAG CTT CCT CTG AGA CAT CCT GCA CTC TTT AAG GCA ATT GGC GTG AAG CCT CCT CGG GGA ATT CTC CTC TAT GGA CCT CCT GGA ACT GGG AAG ACC TTG ATT GCC CGA GCT GTG GCA AAT GAG ACT GGA GCT TTT TTC TTC CTG ATC AAT GGT CCT GAG ATT ATG AGC AAG TTG GCT GGT GAG TCT GAG AGC AAC CTT CGT AAA GCC TTT GAG GAG GCT GAA AAG AAT GCT CCT GCT ATC ATA TTC ATC GAT GAG CTA GAT GCC ATT GCT CCC AAA AGA GAG AAA ACT CAT GGG GAG GTG GAG CGG CGT ATC GTA TCA CAG TTA TTG ACC CTT ATG GAT GGG CTA AAG CAG AGA GCA CAT GTA ATA GTT ATG GCA GCA ACC AAC AGA CCC AAT AGC ATT GAT CCA GCC CTA CGG CGA TTT GGT CGC TTT GAC AGG GAA GTA GAT ATT GGA ATC CCT GAT GCT ACA GGA CGT TTG GAA ATT CTT CAG ATC CAT ACC AAG AAC ATG AAG CTG GCA GAT GAC GTG GAC CTG GAA CAG GTA GCC AAT GAG ACT CAT GGA CAT GTG GGT GCT GAC TTA GCA GCT CTG TGC TCA GAG GCT GCC CTG CAG GCC ATC CGC AAG AAG ATG GAT CTA ATT GAC TTA GAG GAT GAG ACC ATT GAT GCT GAA GTC ATG AAC TCC CTG GCA GTG ACT ATG GAT GAT TTC CGG TGG GCC TTG AGT CAG AGC AAC CCA TCA GCA CTG CGG GAA ACT GTG GTA GAA GTG CCA CAG GTA ACC TGG GAA GAC ATT GGG GGC CTG GAG GAT GTC AAA CGT GAG CTT CAG GAG CTA GTC CAG TAT CCT GTA GAA CAC CCA GAC AAA TTT CTT AAG TTT GGT ATG ACA CCA TCC AAG GGA GTT CTA TTC TAT GGA CCT CCA GGC TGT GGG AAA ACC TTG CTG GCT AAA GCT ATT GCT AAT GAA TGC CAG GCC AAC TTC ATC TCC ATC AAG GGT CCT GAA CTG CTC ACC ATG TGG TTT GGA GAA TCT GAG GCC AAT GTC AGG GAA ATC TTT GAC AAG GCA CGC CAA GCT GCT CCT TGT GTG CTG TTT TTT GAT GAG CTG GAT TCA ATT GCC AAA GCT CGT GGT GGT AAC ATT GGA GAT GGT GGT GGG GCT GCT GAC CGA GTA ATT AAC CAG ATC CTG ACA GAA ATG GAT GGC ATG TCC ACA AAA AAG AAT GTT TTC ATC ATT GGC GCT ACC AAT CGG CCT GAC ATT ATT GAT CCT GCC ATC CTA AGA CCT GGC CGC CTT GAT CAG CTT ATT TAC ATC CCA CTG CCT GAT GAG AAG TCC CGT GTT GCC ATC CTC AAG GCC AAT CTG CGC AAG TCC CCA GTT GCC AAG GAA GTA GAA GAA GAT GAT CCA GTG CCA GAG ATC CGC AGA GAT CAC TTT GAG GAA GCC ATG CGC TTT GCC CGT CGT TCT GTC AGT GAT AAT GAC ATT CGG AAG TAT GAA ATG TTT GCT CAA ACC CTT CAG CAG AGT CGA GGT TTT GGC AGT TTC AGA TTC CCT TCA GGG AAC CAG GGT GGA GCT GGC CCT AGT CAG GGC AGT GGA GGT GGC ACA GGT GGC AGT GTG TAC ACG GAA GAT AAT GAT GAT GAC CTG TAC GGC ,7.9
ATG GGG CTG GAG CGG CTT TCC CCG GGG ATG CTC GCG TGG CTG CTG GCC ACC GGG GCT GCC CTC TGC GCG GGA CTG GGG GTC TGC GCC GGC CTC GAC TAT GAC TAC ACT CTG GCT GGC TAC GGA GAG GAT GAG GCG GAG ACG CTG GAC TAC AAG GAC CCG TGC AAA GCC GCT GTA TTT TGG GGT GAC ATT GCC TTA GAT GAT GAA GAT TTA AAT GTC TTT CAA ATT GAT AGG ACA ATT GAC CTT ACA CAG AAC CCC TTT GGA AAA TTT GGA CAC ACC ACA GGT GGA TTT GGA GAC CAT GGT ATC TCA AAG AAA CGA GGA GCC CTC TAC CAG CTT ATA GAG AGA ATA AGA AGA ATT GGC TCT GGC TTG GAG CAA AAC AAC ACA GTT AAA GAA AAA TTA CCA CTA AAA TTC TCA GGG CAA AGT GAG AAA AAT AGA GTT CCC AGG GCT GCT ACA TCA AGG ACT GAA AGA GTG TGG CCT GGA GGT GTT ATT CCT TAC GTC ATA GGA GGC AAC TTC ACT GGC AGC CAG CGA GCC ATG TTC AAG CAG GCC ATG AGG CAC TGG GAA AAA CAT ACG TGT GTG ACT TTC ATT GAA AGA GGG GAC GAA GAG AGT TAC ATT GTA TTC ACG TAT AGG CCT TGT GGA TGC TGC TCC TAT GTA GGT CGG CGT GGA AAT GGA CCT CAG GCA ATC TCT ATT GGC AAG AAT TGT GAT AAA TTT GGA ATT GTT GTT CAT GAA TTG GGC CAT GTG ATA GGC TTT TGG CAT GAA CAC ACA CGC CCA GAT AGA GAT AAC CAT GTG ACA ATC ATA AGG GAA AAC ATC CAG CCA GGT CAA GAG TAC AAC TTT CTG AAG ATG GAG CCT GGG GAA GTG AAC TCA CTT GGA GAA AGC TAT GAT TTT GAC AGC ATC ATG CAT TAT GCT AGG AAC ACC TTC TCA AGG GGG ATG TTT CTG GAT ACC ATT CTC CCT TCA CGT GAT GAT AAT GGC ATT CGT CCA GCA ATT GGT CAA CGA ACC CGC TTA AGC AAA GGT GAT ATT GCA CAG GCA AGA AAG CTG TAT AGA TGT CCA GCA TGT GGA GAA ACC CTA CAA GAA TCC AAT GGT AAT CTT TCC TCT CCA GGA TTT CCA AAT GGC TAT CCA TCT TAT ACA CAC TGC ATC TGG AGA GTC TCT GTG ACC CCA GGA GAG AAG ATT GTT TTA AAT TTT ACT ACA ATG GAC CTA TAC AAA AGT AGT TTG TGC TGG TAT GAT TAT ATT GAA GTA AGA GAT GGG TAC TGG AGG AAG TCA CCT CTC CTT GGT AGA TTC TGT GGG GAC AAA TTG CCT GAA GTT CTC ACC TCT ACA GAA AGC AGA ATG TGG ATT GAG TTT CGC AGC AGC AGC AAC TGG GTA GGA AAG GGC TTT GCA GCA GTC TAT GAA GCT ATC TGT GGA GGT GAG ATA CAT AAA AAT GAA GGA CAG ATT CAA TCT CCT AAC TAT CCT GAT GAC TAC AGG CCA ATG AAA GAA TGT GTG TGG AAA ATA GCA GTG TCA GAA GAC TGC TAC GTC GGC CTG ATC TTT CAG GCC TTT GAG CAG GAG CCC CAG GAG AAT ACA GGG GTT ACT CAA AAG CCC AGA GAA TAT TTC CCT CAC CTG  ATC TCT ATT GAA AGA CAT GAC AAT TGT GCC TAT GAC TAC CTG GAA GTT CGA GAT GGA ACC AAT GAA AGT AGT CCT TTG ATA GGA CGT TTT TGT GGT TAT GAT AAA CCT GAA GAT ATC AGA TCT ACC TCC AAT ACC TTG TGG ATG AAG TTT GTT TCG GAT GGA ACT GTG AAC AAG GCA GGG TTT GCT GCC AAT TTT TTT AAA GAG GAA GAT GAG TGT GCC AAG CCT GAC CGT GGC GGC TGT GAG CAG CAC TGT TTG AAC ACG CTG GGC AGC TAC CAG TGC TCC TGC GAG CCG GGC TAC GAG CTG GGG CCC GAC AGA AGG ACC TGC GAA GCG GCT TGT GGT GGA CTT CTT ACG AAC CTA AAT GGC ACC ATA ACC ACC CCA GGA TGG CCC AAG GAG TAC CCT CCC AAC AAA CAC TGT ATA TGG CAA GTG GTT GCA CCA ACA CAG TAC AGA ATT TCT GTG AAG TTT GAG TTT TTT GAA TTG GAG GGC AAT GAA GTA TGC AAG TAT GAC TAT GTG GAG ATT TGG AGC GGT CTC TCT TCT GAG TCT AAA CTG CAT GGC AAA TAC TGC GGT GCT GAA GTG CCT GAA GTG ATC ACA TCC CAG TTC AAC AAT ATG AGA ATA GAA TTC AAA TCT GAC AAC ACT GTA TCC AAG AAG GGC TTC AAA GCA CAT TTC TCC TCA GAC AAA GAT GAG TGT TCT AAG GAT AAC GGC GGG TGT CAA CAC GAG TGT GTC AAC ACG ATG GGA AGC TAC CTG TGT CAG TGT CGA AAC GGA TTT GTG CTG CAT GAA AAT AAG CAT GAC TGC AAG GAA GCT GAG TGT GAA CAG AAG ATT CAC AGT CCA AGT GGC TTC ATC ACT AGT CCC AAC TGG CCA GAC AAG TAC CCA AGC AGA AAA GAA TGC ACA TGG GAA ATC ATT GCC ACT CCT GGT CAT CGA ATC AAA TTA GCC TTT ACT GAA TTT GAG ATT GAG CAG CAT CAA GAA TGT GCT TAT GAT CAC TTG GAA GTG TTT GAT GGA GAA ACA GAA AAA TCA CCA GTT CTT GGA CGG CTG TGT GGG AAT AAG ATA CCA GAG CCA CTT GTG GCT TCT GGA AAT AGC ATG TTT GTT CGG TTT GTT TCT GAT GCG TCT GTT CAA AGA AAA GGT TTT CAA GCC GCT CAT TCT ACA GAG TGT GGT GGC AGA CTG AAA GTG GAA TCA AAA TCC AGA GAT CTG TAC TCA CAT GCT CAG TTT GGT GAT AAC AAC TAC CCA GGA CAA GTT GAT TGT GAA TGG CTG TTA GTG TCA GAA CGG GGC TCT CGA CTC GAA TTG TCC TTC CAG ATT TTT GAA GTG GAA GAA GAA GCT GAC TGT GGC TAT GAC TAC GTT GAG CTC TTT GAT GGT CTT GAT TCA ACA GCA GTG GGG CTT GGT CGA TTC TGT GGA TCA GGG CCA CCA GAA GAA ATC TAT TCA ATT GGT GAT ACA GTT TTA ATT CAT TTT CAT ACT GAT GAC ACA ATC AGC AAG AAA GGA TTT CAT ATA AGA TAC AAA AGC ATC AGA TAT CCA GAT TCC CCA CAT ACC AAA AAA ,17.0
