ATG GTG CCC GGC GAG GAG AAC CAA CTG GTC CCG AAG GAG GCA CCA CTG GAT CAC ACC AGT GAC AAG TCT CTT CTT GAT GCT AAT TTT GAG CCA GGA AAG AAG AAC TTT CTG CAT TTG ACA GAT AAA GAT GGT GAA CCG CCT CAG ATG TTG TTG GAG GAC TCC AAT AAC GTG GAT GAC AGC GTG CAT GAC AGG TTC ATA GGT CCA CTG CCA AGA GAA GGT TCT GTG GCC TCT ACC AAT GAT TAT GTC AGC CAG AAC TAC TCC TAT TCA TCA ATT TTG AAC AAG TCA GAA ACT GGT TAT GTG GGA TTA GTA AAC CAG GCG ATG ACG TGC TAT TTG AAT AGC CTT TTG CAA ACA CTT TTT ATG ACT CCT GAA TTT AGG AAT GCA TTA TAT AAG TGG GAA TTT GAA GAC TCT GAA GAA GAT CCT GTG ACG AGT ATC CCA TAC CAG CTT CAA AGG CTT TTT GTT CTG TTA CAA ACC AGC AGG AAG AGA GCA ATC GAG ACC ACA GAT GTT ACG AGG AGC TTT GGA TGG GAC AGC AGC GAG GCT TGG CAA CAG CAT GAT ATA CAA GAA CTG TGC CGT GTT ATG TTT GAT GCT TTG GAA CAG AAA TGG AAG CAA ACA GAA CAG GCT GAT CTT ATA AAT GAG CTG TAC CAA GGC AAG CTG AAA GAT TAT GTG AGG TGT CTG GAA TGC GGT TAT GAA GGC TGG AGA ATT GAC ACG TAT CTT GAT ATT CCA CTG GTC ATC CGA CCT TAT GGG TCC AGC CAA GCG TTT GCT AGT GTG GAA GAA GCA TTG CAT GCA TTT ATT CAA CCA GAG ATC TTG GAT GGC CCC AAT CAA TAT TTT TGT GAA CGT TGT AAG AAG AAG TGT GAT GCT CGG AAG GGC CTT CGG TTT TTG CAT TTC CCC TAT CTG CTG ACC TTA CAG TTG AAA AGG TTT GAT TTT GAT TAT ACA ACC ATG CAT AGA ATT AAA CTG AAT GAT CGA ATG TCA TTT CCG GAG GAG CTG GAT ATG AGC ACA TTT ATT GAT ATT GAA GAT GAG AAA TCT CCT CAG ACT GAA AGT TGC ACT GAT AGT GGA GCA GAA AAT GAA GGC AGT TGC CAC AGC GAC CAG ATG AGT AAT GAT TTC TCC ACG GAT GAT GCT GTT GAT GAA GGG ATA TGC CTG GAG AGC AGT AGT GGG AGT GAG AAG ATT TCA AAA CCT GGC CTG GAA AAG AAC TCC CTG ATG TAT GAG CTC TTC TCA GTG ATG GTG CAT TCA GGG AGT GCT GCT GGA GGA CAC TAT TAT GCT TGC ATA AAG TCT TTC AGT GAC GAT CAA TGG TAC AGT TTC AAT GAC CAA CAT GTG AGC AGG ATA ACA CAA GAA GAC ATT AAG AAG ACA CAT GGT GGG TCT TCA GGA AGC AGA GGC TAC TAC TCC AGT GCT TTT GCA AGC TCA ACA AAT GCA TAT ATG CTG ATA TAC AGA CTG AAG GAT CCA ACA AGA AAT GCA AAA TTT CTA GAA GTG GAC GAG TAC CCA GAA CAC ATT AAG AAT CTG GTG CAG AAG GAG AGA GAA CTG GAA GAA CAG GAA AAG AGG CAA CGA GAA ATT GAA CGC AAC ACA TGC AAG ATA AAA TTA TTC TGT TTG CAT CCT GTG AAA CAA GTA ATG ATG GAA AAC AAG CTG GAG GTT CAT AAG GAT AAG ACG CTA AAG GAA GCC GTT GAA ATG GCT TAT AAG ATG ATG GAT TTA GAA GAT GTG ATT CCC TTG GAT TGC TGT CGC CTG GTA AAA TAT GAC GAG TTT CAT GAT TAC CTG GAA CGA TCG TAT GAG GGA GAA GAA GAT ACA CCA ATG GGG TTG CTT CTA GGA GGA GTC AAG TCC ACA TAC ATG TTT GAC CTG CTG TTG GAA ACG AGA AAG CCT GAT CAA ATT TTT CAG TCT TAC AAA CCT GGA GAA GTG ATG GTG AAA GTT CAT GTT GTT GAT CTG AAA GCA GAG ACT GTC GCT GCT CCT GTA ACA GTG CGT GCG TAT TTA AAT CAG ACA GTT ACA GAG TTC AAA CAG CTG ATC TCA AAG GCC ACG CAC TTA CCT GCA GAC TCC ATG AGG ATA GTG CTG GAG CGC TGC TAC AAT GAC CTG CGC CTT CTC AGC ATG CCC AGC AAG ACC CTG AAG GCT GAG GGC TTC TTC AGA AGT AAC AAG GTG TTT GTT GAA AGC TCT GAG ACA GTG GAT CAC CAG GCA GCC TTT ACA GAC TCC CAC TTG TGG AAA CTC CTG GAT CGA CAT GCA AAT ACA ATC CGG TTA TTT GTT TTG CTG CCT GAA CAA TCT CCA GGA TCA TAT TCG AAA AGG ACA GCA TAC CAG AAA GCT GGA GGT GAT TCT GGT AAT GTG GAC GAT GAT TGT GAA AGA GTC AAA GGA CCT GCA GGG AAT TTA AAG TCT GTG GAT GCT ATT CTA GAA GAG AGC ACT GAA AAA CTG AAA AGC TTG TCA CTG CAG CAG CAG CAG CAA GAT GGG GAC AAC GGA GAC AGC AGC AAA AGC ACT GAG ACA AGT GAC TTT GAA AAT ATT GAA TCC CCT CTC AAT GAG AGG GGC TCT TCC ACC TCT GTG GAT AAT CGA GAA CTT GAA CAG CAC ATT CAG ACT TCT GAC CCA GAA AAC TTT CAG TCT GAG GAA CGC TCG GAC TCA GAT GTG AAT AAT GAC CGG AGT ACA AGT TCG GTA GAC AGT GAT ATT CTC AGC TCC AGT CAC AGC AGT GAC ACT TTG TGC AAT GCA GAC AGC GCT CAG ATT CCT CTG GCC AAT GGA CTT GAC TCT CAC AGT ATC ACA AGT AGT AGA AGA ACT AAA GCA AAC GAG GGG AAA AAG GAG ACC TGG GAC ACA GCT GAA GAA GAC TCT GGG ACT GAC AGT GAA TAT GAC GAG AGT GGC AAG AGC AGG GGG GAC ATG CAG TAC ATG TAC TTC AAA GCT GAC CCC TAC ACT GCG GAT GAA GGC TCT GGG GAA GGA CAC AAA TGG TTG ATG GTG CAT GTT GAT AAG AGA ATC ACC CTG GCA GCT TTC AAA CAG CAT TTA GAA CCT TTT GTT GGA GTC CTC TCC TCT CAC TTC AAG GTT TTT CGA GTG TAC ACC AGC AAT CAA GAG TTT GAG ACC GTC CGG TTG AAT GAG ACC CTT TCA TCA TTT TCA GAT GAC AAT AAG ATC ACA ATC CGA CTG GGG AGA GCA CTG AAG AAG GGA GAG TAC AGA GTT AAA GTG TGC CAG CTC TTA GTC AAT GAG CAA GAG CCA TGC AAG TTT CTG CTA GAC GCT GTG TTT GCT AAA GGC ATG ACT GTA CGG CAA TCA AAA GAG GAG CTG ATT CCT CAA CTC AGG GAG CAG TGT GGC TTA GAC CTC AGC ATC GAC AGG TTT CGT CTA AGG AAG AAA ACA TGG AAG AAT CCT GGC ACT GTC TTT TTG GAT TAT CAT ATT TAT GAA GAA GAT ATT AAT ATT TCC AGC AAC TGG GAA GTT TTC CTG GAA GTT CTT GAT GGT GTG GAG AAG ATG AAG TCC ATG TCA CAG CTC GCC ATC TTA ACA AGA CGC TGG AGG CCT GCA GAG ATG AAG TTG GAC CCC TTC CAG GAG CTT GTG TTG GAA AGC AAT AGT GTT GAT GAA CTC CGA GAG AAG CTA AGT GAA ATC AGT GGG ATT CCT TTG GAA GAC ATT GAA TTT GCC AAG GGT AGG GGA ACC TTC CCC TGT GAT ATT TCT GTC CTT GAT ATT CAT CAA GAT TTG GAC TGG AAT CCT AAA GTC TCT ACC CTG AAT GTT TGG CCT CTT TAT ATC TGT GAT GAT GGT GCC GTC ATA TTT TAT AGG GAT AGA ACA GAA GAA GTA ATG GAA TTG ACA GAT GAG CAA AGA AAT GAA TTG ATG AAA AAG GAA AGC AGC CGA CTG CAG AAG ACG GGA CAT CGT GTG ACA TAC TCC CCT CGC AAA GAG AAA GCA CTC AAG ATC TAC CTG GAT GGG GCG CCA AAT AAA GAT GTG GCT CAA GAC ,3.5
ATG GAA GGA ACC CGA GCC CGC GGA GCG CAG CTG AGA CTG GGG GAG CGC GTT CGG CCG GCT GGG CGC GGC TCG GCG CCG GGG CGC AGC AGG TTC CGT CAG CCC TGG CGC CCA GGC GCA TCT GAC TCG GCA CCC CCT GCA GGC ACC ATG GCC CAG AGC CGG GCG CTG CTG CTC CTG CTG CTG CTG CCG CCA CAG CTG CAC CTG GGA CCT GTG CTT GCC ATG AGA GCC CCA GGA TTT GGT CGA AGC GGC GGC CAC AGC CTG AGC CCT GAA GAG AAC GAA TTT GCG GAG GAG GAG CCC GTG CTG GTC CTG AGC CCT GAG GAG CCC GGG CCT GGC CCA ACC GCG ATC AGC TGT CCC CGA GAC TGT GCC TGT TCC CAG GAG GGC GTC GTG GAC TGT GGC GGC ATC GAC CTG CGT GAG TTC CCG GGG GAC CTG CCT GAA CAC ACC AAC CAC CTG TCT CTG CAG AAC AAC CAG CTG GAA AAG ATC TAC CCT GAG GAG CTC TCC CGG CTG CAC CGG CTG GAG ACG CTG AAC CTG CAG AAC AAC CGC CTG ACT TCC CGA GGG CTC CCA GAG AAG GCG TTT GAG CAC CTG ACC CAC CTC AAT TAC CTG TAC TTG GCC AAT AAC AAG CTG ACC TTG GCA CCC CGC TTC CTG CCA AAC GCC CTG ATC AGT GTG GAC TTT GCT GCC AAC TAT CTC ACC AAG ATC TAT GGG CTC ACC TTT GGC CAG AAG CCA AAC TTG AGG TCT GTG TAC CTG CAC AAC AAC AAG CTG GCG GAC GCC GGG CTG CCG GAC AAC ATG TTC AAC GGC TCC AGC AAC GTC GAG GTC CTC ATC CTG TCC AGC AAC TTC CTG CGC CAC GTG CCC AAG CAC CTG CCG CCT GCC CTG TAC AAG CTG CAC CTC AAG AAC AAC AAG CTG GAG AAG ATT CCC CCA GGG GCC TTC AGC GAG CTG AGC AGC CTG CGC GAG CTG TAC CTG CAG AAC AAC TAC CTG ACT GAC GAG GGT CTG GAC AAT GAG ACC TTC TGG AAG CTC TCC AGC CTG GAG TAC CTG GAT CTG TCC AGC AAC AAC CTG TCT CGG GTC CCA GCT GGG CTG CCG CGC AGC CTG GTG CTG CTG CAC TTG GAG AAG AAC GCA ATC CGG AGC GTG GAT GCG AAC GTG CTG ACC CCC ATC CGC AGC CTG GAG TAC CTG CTG CTG CAC AGC AAC CAG CTG CAG GCA CAG GGT ATC CAC CCG CGG GCC TTC CAG GGC CTC AAG CGG CTG CAC ACG GTG CAC CTG TAC AAC AAC GCG CTG GAG CGC GTG CCC AGC GGC CTG CCT CGC CGC GTG CGC ACC CTC ATG ATC CTG CAC AAC CAG ATC ACA GGC ATC GGC CGC GAA GAC TTT GCC ACC ACC TAC TTC CTG GAG GAG CTC AAC CTC AGC TAC AAC CGC ATC ACC AGC CCG CAG GTG CAC CGC GAC GCC TTC CGC AAG CTG CGC CTG CTG CGC TCG CTG GAC CTG TCG GGC AAC CGG CTG CAC ACG CTG CCA CCT GGG CTG CCT CGA AAT GTC CAT GTG CTG AAG GTC AAG CGC AAT GAG CTG GCT GCC CTG GCA CGC GGG GCA CTG GCG GGC ATG GCC CAG CTG CGT GAG CTG TAC CTC ACC AGC AAC CGA CTG CGC AGC CGG GCC CTG GGC CCC CGC GCC TGG GTG GAC CTT GCC CAT CTG CAG CTG CTG GAC ATC GCC GGG AAT CAG CTC ACA GAG ATC CCC GAG GGG CTC CCC GAG TCA CTT GAG TAC CTG TAC CTG CAG AAC AAC AAG ATT AGT GCG GTA CCC GCC AAT GCC TTC GAC TCC ACA CCC AAC CTC AAG GGG ATC TTT CTC AGG TTT AAC AAG CTG GCT GTG GGC TCC GTG GTG GAC AGC GCC TTC CGG AGG CTG AAG CAC CTG CAG GTC TTG GAC ATT GAA GGC AAC TTT GAG TTT GGT GAC GTT TCC AAG GAC CGT GGC CGC TTG GGG AAG GAA AAG GAG GAG GAG GAA GAA GAG GAG GAG GAA GAG GAA GAG GAA ACA AGA ,30.8
ATG AAG GCG GCG GAT GAG CCT GCC TAC CTG ACA GTG GGA ACT GAT GTC AGT GCC AAG TAC CGG GGT GCC TTC TGT GAG GCA AAA ATT AAG ACT GTG AAA AGG CTG GTG AAA GTT AAG GTA CTC CTG AAA CAG GAT AAT ACC ACG CAA TTG GTA CAA GAT GAC CAA GTA AAG GGT CCT TTA AGA GTT GGA GCT ATT GTT GAA ACA AGG ACA TCT GAT GGA TCT TTT CAG GAA GCT ATT ATC AGC AAG TTG ACA GAT GCT AGT TGG TAT ACC GTG GTG TTT GAT GAT GGT GAC GAG CGA ACA TTG AGA CGT ACC TCG CTT TGT CTG AAA GGA GAG AGA CAT TTT GCA GAG AGT GAG ACA CTT GAC CAG CTT CCG TTA ACG AAT CCA GAG CAT TTT GGA ACT CCA GTA ATT GCA AAG AAG ACA AAC AGG GGA AGG AGG TCT TCT CTT CCT GTT ACC GAA GAT GAA AAG GAA GAA GAA AGT AGT GAA GAG GAA GAT GAA GAC AAG CGC CGT CTC AAT GAT GAA TTA CTA GGA AAA GTT GTA AGT GTG GTG TCT GCA ACT GAG AGG ACT GAA TGG TAC CCT GCT TTG GTA ATA TCT CCC AGC TGT AAT GAT GAC ATC ACA GTG AAA AAA GAT CAG TGT TTA GTT CGA TCA TTT ATT GAT TCT AAA TTT TAC TCT ATA GCA AGA AAG GAC ATT AAG GAA GTA GAC ATT CTC AAT CTA CCA GAA TCT GAG CTC TCC AGT AAA CCA GGG CTT CAG AAA GCA AGC ATC TTC TTA AAA ACT AGA GTT GTT CCT GAT AAT TGG AAA ATG GAT ATA AAT GAA ATC CTT GAG TCA TCC AGT AGT GAT GAT GAA GAT GGC CCA GCT GAA GAA AAT GAT GAA GAA AAG GAA AAG GAG GTC AAA AAG ACA GAA GAA GAG GTG CCT GAG GAA GAA CTT GAT CCT GAG GAG AGG GAC AAC TTC CTC CAG CAG CTT TAT AAG TTT ATG GAA GAC AGA GGT ACT CCA ATC AAC AAA CCA CCT GTT TTG GGC TAT AAA GAT CTC AAT CTC TTC AAA CTC TTC AGA CTG GTT TAT CAT CAG GGT GGA TGT GAC AAT ATT GAT AGT GGT GCT GTA TGG AAG CAA ATT TAT ATG GAC CTT GGC ATT CCT ATT TTG AAT TCA GCT GCT TCC TAC AAT GTA AAA ACT GCT TAT AGA AAG TAT CTG TAT GGT TTT GAG GAG TAC TGC CGT TCG GCA AAT ATT CAG TTC AGA ACT ATT CAT CAC CAT GAA CCA AAA GTA AAA GAG GAA AAA AAA GAC TTA GAA GAA TCA ATG GAA GAG GCT CTC AAA TTA GAT CAA GAA ATG CCT TTA ACA GAA GTG AAG AGT GAA CCT GAG GAA AAT ATT GAT TCA AAC AGT GAA AGT GAA AGA GAA GAG ATA GAA TTA AAA TCT CCA AGG GGA CGA AGG AAA ATT GCT CGA GAT GTA AAT TCT ATT AAA AAG GAA ATT GAA GAA GAG AAA ACA GAA GAC AAA TTA AAA GAC AAT GAT ACA GAA AAT AAG GAT GTA GAT GAT GAC TAT GAA ACT GCA GAG AAA AAA GAA AAT GAG CTA CTA CTG GGG AGA AAA AAT ACA CCA AAG CAA AAA GAG AAG AAA ATT AAA AAA CAG GAG GAT TCT GAC AAA GAT TCA GAT GAA GAG GAA GAG AAA AGC CAA GAG AGG GAA GAA ACT GAA AGC AAA TGT GAC TCT GAG GGA GAG GAA GAT GAG GAA GAC ATG GAA CCC TGC CTA ACA GGA ACC AAA GTG AAA GTA AAA TAC GGA CGA GGG AAG ACT CAG AAA ATT TAT GAA GCC AGT ATT AAA AGC ACT GAA ATT GAT GAT GGA GAA GTT TTA TAT TTG GTA CAT TAC TAT GGA TGG AAT GTC AGG TAT GAT GAG TGG GTG AAG GCT GAC AGG ATA ATC TGG CCT TTG GAC AAA GGT GGA CCA AAG AAA AAA CAG AAG AAA AAA GCG AAA AAT AAA GAA GAT AGT GAA AAG GAC GAA AAG AGA GAT GAG GAG AGG CAG AAG TCA AAA CGG GGA CGA CCT CCT TTA AAA TCA ACC CTT TCA TCA AAC ATG CTG TAT GGC TTA TCT AAG ACA GCA AAC AGT GAA GGA AAA TCA GAC TCT TGT TCA TCT GAT AGT GAA GCA GAA GAT GCT TTA GAA AAG AAT CTA ATA AAT GAA GAA CTT TCT CTT AAA GAT GAA CTA GAA AAA AAT GAA AAT TTG AAT GAT GAT AAG CTA GAT GAA GAA AAT CCA AAG ATT TCT GCA CAC ATA TTA AAA GAA AAT GAT AGG ACT CAG ATG CAG CCT TTA GAA ACC CTG AAG TTA GAA GTT GGA GAG AAT GAA CAA ATA GTA CAG ATT TTT GGA AAC AAA ATG GAA CAA GCA GAA GAA GTT AAG AAA GAA GCC GAA AAA TCT CCA AAA GGA AAG GGA AGA CGA AGC AAG ACA AAA GAT CTT TCT TTA GAA ATT ATA AAG ATT TCA TCA TTT GGC CAG AAT GAA GCA GGA AGT GAA CCT CAT ATA GAG GCT CGT AGT CTT GAA TTG TCT TCA TTA GAC AAT AAA AAC TTC TCT TCT GCT ACA GAA GAT GAA ATT GAC CAA TGT GTG AAA GAA AAG AAG TTG AAA CGG AAA ATA CTA GGA CAA TCA TCA CCA GAG AAA AAA ATA AGA ATT GAG AAT GGA ATG GAA ATG ACA ACT ACT GTA TCT CAA GAA AGG ACC AGT GAT TGT ATT GGA TCT GAG GGA ATG AAA AAG TTA AAT TTT GAA CAG CAT TTT GAA AGA GAA AAT GAA GGA ATG CCA TCA TTG ATA GCA GAG TCA AAC CAA TGC ATC CAA CAA CTG ACT AGT GAA AGA TTT GAT AGT CCA GCT GAA GAA ACT GTA AAT ATT CCA CTA AAA GAA GAT GAG GAT GCA ATG CCT CTG ATT GGG CCT GAA ACC TTG GTT TGC CAT GAA GTA GAT TTG GAT GAT TTG GAT GAA AAG GAT AAG AAC AGC ATT GAG GAT GTA GCA GTT GAA AGC TCT GAG TCT AAC TCT CTT GTT TCT ATT CCA CCT GCC CTA CCT CCT GTA GTC CAA CAT AAC TTT TCA GTA GCT TCA CCA CTT ACT CTT AGT CAA GAT GAG TCT CGA AGT GTA AAA AGT GAG AGT GAT ATA ACG ATT GAA GTT GAT AGT ATT GCT GAA GAA TCT CAA GAA GGT CTT TGT GAG AGG GAA TCG GCA AAT GGA TTT GAA ACT AAT GTT GCC TCT GGT ACC TGT AGT ATA ATT GTA CAA GAG AGA GAG AGC AGA GAG AAG GGT CAG AAA AGA CCA AGT GAT GGC AAT AGT GGA TTA ATG GCA AAA AAG CAA AAG CGT ACC CCA AAG CGA ACA AAT GCT GCA GCC AAA AAT GAA AAG AAT GGA ACG GGA CAA AGC AGT GAT AGT GAA GAT CTT CCT GTC CTA GAC AAT TCA AGT AAA TGT ACC CCA GTA AAG CAT CTT AAT GTA TCT AAG CCA CAG AAA CTT GCA CGA TCT CCT GCA AGA ATA TCC CCA CAC ATC AAA GAT GGA GAG AAA GAT AAA CAC AGA GAA AAA CAT CCA AAT TCA TCC CCT AGG ACA TAT AAA TGG AGC TTT CAA CTC AAT GAA TTA GAT AAT ATG AAC AGT ACG GAG AGA ATC TCA TTT CTC CAA GAA AAA CTA CAG GAA ATC AGA AAA TAT TAT ATG TCT TTG AAG TCT GAA GTT GCA ACC ATA GAC AGG AGG AGA AAA AGA TTA AAA AAG AAA GAC AGG GAA GTG TCT CAT GCG GGA GCC TCC ATG TCA TCT GCT TCA TCA GAC ACT GGA ATG AGT CCC TCA TCA TCA TCT CCC CCA CAA AAT GTA CTT GCT GTA GAA TGC AGG ,26.0
ATG ACA GCG GAT CTG CGG AAA GGC TGG GTG TCT CTG GGC CGT GCG GAC CCT GAG GAA GAG CTG AGT CTC ACG TTT GCC CTG GGA CAG CAG AAC CTG GAG AGA CTG TCC GAG CTG GTG CAG GCT GTG TCG GAT CCC AGC TCT TCT CGC TAC GGA AAG TAC CTG ACC CTA GAG GAT GTG GCT GAA CTG GTC CGG CCA TCA CCA CTG ACC CTC CAC ACA GTC CAA AAA TGG CTT TTG GCT GCT GGA GCC CGG AAC TGC CAC TCA GTG ACT ACA CAG GAC TTT CTG ACT TGC TGG CTG AGT GTC CGA CAA GCA GAG CTG CTG CTC TCT GGG GCT GAG TTT CAT CGC TAT ATG GGG GGA CCT GCA GAG ACC CAT GTT GTA AGG TCC CCA CAT CCC TAC CGG CTC CCG AAG GCC TTG GCC TCC CAC GTG GAC TTT GTG GGG GGG CTG CAC CGC TTT CCC CCC ACA TCA ACC CTG AGG CAA CGC CCT GAG CCA CAG GTG CCA GGG ACT GTT GGC CTG CAC CTG GGG GTG ACC CCA TCT GTG ATC CGT GAG CGG TAC AAC TTG ACG GCA CAA GAC GTG GGC TCT GGC ACG ACC AAC AAC AGT CAA GCC TGT GCC CAG TTC CTG GAG CAG TAT TTC CAT GAC TCA GAC CTG GCT GAG TTC ATG CGC CTC TTC GGT GGG AAG TTT GCA CAC CAG GCA TCA GTA GCC CGT GTG GTC GGA CAG CAG GGC CGG GGC CAG GCC GGA ATC GAG GCC AGC CTA GAT GTG GAG TAC CTG ATG AGT GCT GGC GCC AAC ATC TCC ACC TGG GTC TAC AGT AGC CCT GGC CGG CAT GAG TCA CAG GAG CCC TTC CTG CAG TGG CTC CTC CTG CTC AGT AAT GAG TCA GCC CTG CCA CAT GTG CAC ACC GTG AGC TAC GGG GAT GAT GAG GAC TCC CTC AGC AGC GCC TAC ATC CAG CGG GTC AAC ACC GAG CTC ATG AAG GCT GCT GCT CGG GGT CTT ACC CTG CTC TTT GCC TCA GGT GAC AGT GGG GCT GGG TGT TGG TCT GTC TCT GGA AGA CAC CAG TTC CGT CCC AGC TTC CCT GCC TCC AGC CCC TAT GTC ACC ACG GTG GGA GGC ACA TCC TTC CAG AAT CCT TTC CGA GTC ACA GAT GAG GTT GTT GAC TAT ATC AGT GGT GGC GGC TTC AGC AAT GTG TTC CCA CGG CCT TCA TAC CAG GAG GAA GCT GTA GCC CAG TAC CTG AGC TCC AGT CCC CAC TTG CCA CCA TCC AGT TAC TTC AAT GCC AGC GGC CGT GCC TAC CCA GAC GTG GCT GCA CTC TCT GAC GGC TAC TGG GTG GTC AGC AAC CAT GTG CCC ATT CCA TGG GTG TCT GGC ACC TCG GCC TCT ACT CCA GTG TTT GGG GGA CTC CTA TCC CTG ATA AAT GAA CAC AGA ATC CTC AGA GGC CTC CCC CCT CTT GGT TTT CTC AAC CCA CGG CTC TAC CAG CAG CAT GGG GCA GGA CTC TTT GAT GTA ACA CGT GGC TGC CAT GAG TCC TGT CTG AAT GAA GAG GTG GAG GGT CAA GGT TTC TGC TCT GGT CCT GGC TGG GAT CCT GTG ACA GGC TGG GGA ACA CCC AAC TTC CCA GCT CTG CTG AAG ATA CTA ATT AAC CCT ,48.0
ATG GCG GCC GTC GAA GCG GCT GCG GAG CCG GTA ACG GTG GTG GCA GCT GTT AGT CCA AAG GCG AAG AAC GAA GAG GAG GAG GAA GAG GAG TCG CTG CCA CCG TGC GAG GCC GTG CGC TGG GCC CCC GTG GGG GCA GTG GCG GAG GCC GCG CCT GGG ACG GCT GCG TTC TCG GAA GAG GCG GCG TCT GAG GAG CCC GGC GCG GCC CCA GGT TCC CCT CCG GAC TCG CCC GGC CGG ACG CTG AGG CGT CTG CGG GCC  CGG CGG CGG CTG GAC TCG GCA CTG CTC GCG CTG TCC TCG CAC TTC GCG CAA GTG CAG TTC CGC CTG CGC CAG GTG GTG CGC GGG GCT CCC GCG GAG CAG CAG CGC CTC CTG CGC GAG CTC GAA GAC TTC GCG TTC CGC GGC TGC CCT CAC GTC CTG GGT TAT GGG GGA CCC GAG GAC CCC GCC AGC GAC GAT GGC GAT GGA CTG CCA GGG GAC CGG CCA CGA TTG CGG GGC GAG AAC CAG AGT GAA CAG GAA AAA CGG GAA CGT CTG GAA ACG CAA AGG GAG AAG CAG AAG GAA CTT ATA CTA CAG CTC AAA ACC CAA CTA GAT GAC CTG GAA ACG TTT GCT TAT CAA GAG GGC AAT TAC GAC TCC CTG CCG CAG TCC GTG GTC TTG GAA AGA CAG CGG GTG ATC ATA GAT GAA TTA ATA AAG AAA CTG GAC ATG AAT CTG AAT GAA GAC ATC AGC TCA CTG TCC ACC GAC GAG CTC CGG CAG CGT GTG GAT GCA GCC GTG GCT CAG ATT GTC AAC CCA GCC CGA GTG AAA GAG CAG TTG GTT GAG CAG TTG AAA ACT CAG ATC CGA GAC CTC GAG ATG TTC ATC AAC TTC ATC CAA GAT GAA GTG GGA AGC CCG TTG CAG GCA GAG AGC GTG CCC TGT GAG TGC AAG GCC GGT GGG AAG ACT GGA AGT GGC TCC ACG AGA ACA GGT GGC AGC AGA CTC CCT CCA GGA AAC AGC CAG ACG AAG GCA GAA GAC GTG AAG AAG GTT CAG CAG TCG GGG CTG CGC CTC ATG CAG CGT GCG CTG GCC GTA CTC CAG ATC TTT GCC GTG AGC CAG CTG GGC TGC GCC ACG GGC CAG ATC CCC CAA ACC CTG TGG CAG AGG GGC CAG GCT GAT GGG GAC TAT GCC CCC TTA CTG AAG AGG TTA GAG ATC TCA GTA GAC AGG GTA AGG CAG CTG GCC CTG AGG CAC CAG CCA CAC GAC CAT GTC ATC ACC TCT GCC AGC CTC CAG GAC CTG TCC CTA GGA GGC AAG GAC GAG CTG ACC ACA GCT GTG CGG AAG GAG CTG ACA GTG GCC GTC AGG GAC CTG CTG GCC CAT GGC CTC TAC GCC GCC TCA CCA GGG ATG AGC CTG GTC ATG GCC CCC ATC GCC TGT TTG CTG CCG GCC TTC TCC TCA GCC CCC GAG GCC ATG CAC CCG TGG GAG CTC TTC GTA AAG TAC TAC CAT GCT AAG AAC GGC CGC GCT TAC GTG GAA TCC CCT GCT CGG AAG CTC TCC CAG TCC TTT GCC CTG CCA GTT ACA GGA GGC ACC GTG GTG ACC CCC AAG CAG AGC CTT CTG ACA GCC ATC CAC ATG GTG CTG ACG GAG CAC GAC CCT TTT AAA CGC AGT GCA GAC TCG GAG TTG AAG GCC TTG GTG TGC ATG GCT CTG AAC GAG CAG CGC CTC GTG TCC TGG GTG AAC CTG ATC TGC AAG TCA GGG TCC CTC ATT GAG CCC CAC TAC CAG CCC TGG AGC TAC ATG GCA CAC ACA GGC TTT GAG AGC GCC CTC AAC CTG CTC AGT CGC CTC  AGC CTC AAG TTC AGC CTC CCC GTG GAC CTG GCC GTG CGC CAG CTC AAG AAC ATC AAA GAT GCC TTC ,11.1
ATG CTT ACA CGG AAC TCT TTA TGC CTG CTT CTC TGG ATC CTG TTT GAT GGA GGT CTC CTA ACA CCA CTT CAG CCA CAG CCA CAA CAG ACT TTA GCC ACA CAA TCA AAA GAA AAT GTT ATC CAC CTG CCG GAG AGA CAA CCC CAT TTC CAA CGG GTT AAA CGT GGC TGG GTA TGG AAT CAA TTT TTT GTG CTG GAA GAA TAC ATG GGC TCC GAA CCT CAA TAT GTG GGA AAG CTG CAT TCT GAC TTG GAC AAA GGA GAG GGC ACT GTT AAA TAC ACG CTC TCT GGA GAT GGT GCT GGG ACC GTT TTT ACA ATT GAT GAA ACT ACA GGA GAC ATT CAT GCA ATA AGA AGT CTG GAC AGA GAA GAA AAG CCT TTC TAC ACA CTT CGT GCT CAG GCA GTG GAC ATA GAA ACA AGA AAA CCC TTG GAG CCT GAA TCC GAG TTC ATC ATT AAA GTG CAG GAT ATT AAT GAT AAT GAG CCA AAG TTT TTG GAT GGA CCT TAT GTC GCT AGT GTT CCA GAA ATG TCT CCT GTG GGT GCC TAT GTG CTC CAG GTT AAG GCC ACA GAT GCG GAT GAC CCC ACC TAT GGA AAC AGT GCC AGA GTC GTT TAC AGC ATT CTT CAG GGC CAA CCT TAT TTC TCT ATT GAT CCC AAG ACA GGT GTT ATT AGG ACA GCG TTG CCA AAC ATG GAC AGA GAA GTC AAA GAG CAG TAC CAG GTC CTC ATT CAA GCG AAG GAC ATG GGA GGA CAA CTC GGT GGC CTC GCT GGA ACA ACA ATT GTC AAT ATT ACC CTT ACT GAT GTC AAT GAC AAC CCA CCT CGA TTC CCA AAA AGC ATC TTC CAC CTG AAA GTC CCT GAG TCT TCT CCT ATT GGT TCA GCG ATT GGA CGG ATA AGG GCA GTA GAT CCT GAT TTT GGA AAA AAC GCA GAA ATT GAA TAC AAC ATT GTT CCA GGA GAT GGG GGA AAT TTG TTT GAC ATT GTC ACA GAT GAA GAT ACA CAA GAA GGA ATC ATC AAA TTG AAA AAG CCT TTG GAT TTT GAA ACG AAG AAG GCG TAT ACA TTC AAA GTA GAG GCC TCC AAC CTT CAC CTT GAC CAC CGC TTT CAC TCT GCT GGC CCC TTT AAA GAC ACT GCT ACA GTC AAA ATT AGC GTG CTG GAT GTG GAT GAG CCT CCG GTG TTC AGC AAG CCC CTT TAC ACC ATG GAG GTT TAT GAA GAC ACT CCT GTG GGG ACC ATC ATC GGG GCT GTC ACA GCC CAA GAC CTA GAT GTG GGC AGT AGT GCT GTT AGG TAC TTC ATA GAT TGG AAG AGT GAT GGG GAC AGC TAC TTC ACA ATA GAT GGA ACG GAA GGA ACC ATC GCC ACG AAT GAA TTA CTG GAC AGA GAG AGC ACA GCG CAG TAT AAT TTC TCC ATA ATT GCA AGT AAA GTT AGT AAC CCA TTA TTG ACC AGC AAA GTC AAC ATA CTG ATT AAT GTA CTA GAT GTC AAT GAA TTT CCT CCA GAA ATA TCT GTG CCA TAT GAG ACA GCT GTA TGT GAA AAT GCC AAA GCA GGA CAG ATA ATT CAG ACA GTA AGT GCT GCA GAC CGA GAT CTT TCA CCT GCT GGG CAG CAA TTC TCC TTT AGA TTA CCA CCA GAG GCT GCC ATC AAA CCA AAT TTT ACA GTT CAT GAC TTC AGA AAC AAC ACA GCT GGA ATT GAA ACC CGG AGA AAT GGA TAC AGC CGC AGG CAG CAA GAG TTG TAT TTC CTA CCA GTT GTA ATA GAA GAC AGC AGT TAC CCT GTC CAG AGC AGC ACG AGC ACA ATG ACT ATT CGT GTT TGC AGA TGT GAC TCT GAT GGG ACC ATC CTG TCC TGT AAT GTC GAA GCA ATT TTC CTA CCT GTG GGA CTG AGC ACT GGA GCT CTG ATT GCA ATA CTG CTA TGC ATT GTT ATA CTC TTA GCT ATA GTT GTG CTG TAT GTA GCC TTG AGG AGA CAG AGG AAG AAA GAC ACC TTG ATG ACA TCT AAG GAA GAC ATA AGA GAC AAT GTC ATC CAT TAT GAT GAT GAA GGA GGT GGG GAG GAA GAC ACC CAG GCT TTT GAC ATT GGG GCT CTG AGA AAT CCC AAG GTG ATT GAA GAG AAT AAA ATT CGC AGG GAT ATA AAA CCA GAC TCC CTC TGT TTA CCT CGC CAC AGA CCA CAT GCG GAA GAC AAC ACA GAC ATA AGG GAT TTT ATT CAC CAA AGG CTA CAG GAA AAC GAT GCG GAT CCA GCT GCC CCA CCA TAT GAT TCC CTG GCC ACT TAT GCA TAT GAG GGA AAT GGG TCA GTG GCA GAA TCA CTC AGC TCC ATA GAC TCT CTC ACC ACA GAA GCA GAC CAG GAC TAT GAC TAT CTC ACA GAC TGG GGG CCC CGC TTT AAA GTC TTG GCA GAC ATG TTT GGA GAA GAG GAG AGT CAC AGT CCT GAT AAT GTG ACC ,2.5
