ATG AAG TCT TTA AAG AAG GAT TCC CGC CTT AGA ATA CCT ACA AAC AGA TTC TTG GAG GCC TCA GAG AGC GTG AAA GAA AAG AAG CGG GCA AAG GTA CCT GAA CAG CCC ACA CCC CCA ATT CAG GAA GAA CCT GAG CCT GTT AGC AAT GTG CTA CAA GGA GAT GAC ATT CTT GCC TTA GCC ATT AAG AGG GAA GAC TTG AGG AAG CAA CAT CTT CCT CGC CTT ATT GAA ACA GAA GAT AAA CAT GTA ATT ACC CAG AGA TAT ATC ATC CGT AAA CCC AAA CCC AAG GAT CAC AGG AGG AAG GTC TCA CAC TTC GTA GCA CAT CCT GCT ACT CCA GAT GCG GCC GCA AAG CCC CTG GAC TAC TCT GGA CCA GGT GAC ATC TTC CAT GGC AGT GAC CAG ATC CTG CCC CAC CAC ATC CTG GGG AGT CTC CAG GAC TTT AAG AGA ATT GCA ATT GCT CGA GGG AAC ACC CAG CTG GCT GAG CTG ATA CAC ACC CCA CCC TGT CTG ATG ACC CTC ATC TCA ACT GAA GAA GAG CCA AAG CAG GAA GCC CCA AAA GAA GAG AAG GCA CAT CCT CCC TGG GTC CCG CCT GTG CAG CAC AAC TTT CTG AAA AAC TGG CAG CGC AAC ATA GCC CTT CGG AAG AAG CAG CAG GAA GCT CTC AGT GAA CGG CTG AAG AAG CCA GTC AGC GAG CTG CTG ATG CAC ACA GGG GAG GCG TAC AGA CAG ATC CAG GAG GAA CGG GAG CTC CTT GAT CGA ATG CTG GCA ACA CGG TCT GAT GGG AAG GGC TGC AAA TTG GCC AGT GGG TTC TGG AGT CAA CTG GAA TAC GTG GGA GAC GAA ATG ACA GGT CTG GTA ATG ACA AAG ACA AAA ACT CAG CAT GGC CTC GTG GAG CCA ATC ACT CAG ATC AAG AAG CCC TGG TCC ATC CAG GCA GAG ATG GGG TTG CCA GCC CAG AAG GAT GCG TGG TAC CGC TAC ACC TGG GAT CGG AGT CTC TTT CTG GCC TGT CGA CGC AAG GAG CTG CAG AGC ATC ATG GCA GAG CTG AAT TTT AGC CAG CAG GAT ATT GAT GGC CTG GAG GTG GTG GGC AAA GGG CGG CCT TTC TCC ACT GTT ACG GTA GAA GAC TAT TCA GTG TTT GAA AGG AGC TTG GAG AGC TCC TCT GAA GAC ACA GTG CAC TTA GAC TTA TTG GCC AAT TAC CCT GAT GTG GTT CCT ATG CCT GTT CTT GGC CCT TCT CTG CTG TTC TGT GGG AAG CCA GCC TGC TGG ATC CGA GGC AGT AAT TCA GAG GAC AAG AGG CAT GTT GGA ATT GCT GTC CGC TTG ACC TTT GAA ACT CTA GAA GGG GAG AAA ACA TCT TCG GAA CTG ACT GTG GTC AAT AAT GGC ACA GTG GCC ATT TGG TAT GAC TGG CGG CGG CGG TCA CAG TGG GAC TCT TTC CAA GAC CTG AAG AGG AAT AGG ATG CAG AGG TTT TAC TTC AAC AAT CGG GAA GGT GTA ATT CTG CCT GGA AAA ACT AAA AAC TTT ACC TTT TTC TTC AAA TCT TTG AAT GCT GGG ATC TTC AGG GAG TGT TGG GAA TTT GGA ACC CAC CCT ACC CTA TTA GGA GGT GCT CTC CTG CAG GTC AAC CTC CAT GCA GTC TCC TTG GCC CAG GAC ATT TTT CGG GAT GAG AGG AAG TTA TTA GAG AGC AAG CTG GCC TCC CAT GAA GCA GTC ACC ATC GTA GAG AAC ATG CTG CAG GAG CTT CTG AGG GGG ATC CTG ACC CCC GAG CGC GCA CAG TCA CCT GTG GAT GCC TCT GTC ACT GAG GAG GAC TTG TTC CAC CAT AGG AAT CCT CAG CTG CGT TAC CAG CAC CAG GTG GTG CAA CAT CTG CAC AGT CTG TGG CGC CAG TAC ATG ATG CTG CCC CTC AAG GCT GAG GAG GCC GGG CCC GGC GAG GAG GGG CAC CTC AGC CCC AGG GCC CAG GCT GCT GCA ACC CCG TCA GCC TAC TCG GAG GAG ACC TCA GTG AAG ATC GAG TCT TCT GCA CAC CTT AAG AGC CCA ACG TTA GAC CCT CAA CTG CCC CGG CAG GAG ACT GAG GCC CTC AAG GAC TCC CAG GAT CAT GTT GGG TCT CAG AAG ACT GGG CTA GGG GTC AGG CAT TCT CAG CGG AAG AGC ATC ATG GAG GAG ATC CTA GTG GAG GGG AGC CCG GAT CCG GAG AGC ATC AGG AGC CCC TGG GAA CTG GAT GGC CTT CCC CTG CCA GAG TGG AAT CTC TGC CTG GAA GAC TTC AGA AAG GCA GTG ATG GCA CTC CCT GAG GAG AAC CAG AGA GAA GAC GCC CTA ATC AGG CTC AAC AAA GCA GCC CTG GAG CTG TGC CAG GAA CCG CGG CCA TTG CAC CCT GAC TTT CTG TAC CAG ATG TGT TTG CAG CTG TGG CGA GAT CTG ATT GAC AGC CTG GTA AGC CAT TCC CTG TGG CTG AGG GCT CTG CTG GGC CTG CCT GAG AAG GAG ACC ATC TAC CTG GAC ATG CCA GAA GAG CAA GAT CGA AAA TCA CCT CCT GTC ACA GAA GTG AAG GTG ACT TCC GGG AAA GTG GGA AAG GAG GAC CGG AAA GGG GCA TCC CAG GAA AAG AAG CAG TTT GGA ATC AGA GAC AAA GAA GAT AAA AAA GGA GCC AAG CTG TCA CCT GGG AAA GAG GAC CGT TTA AAC AGC AAG AAG CAT AAA ACA AAG GAT GAC AAG AAG CCG GCA AAA TCT TTA AGT CGG GAT AGG CTT TCC TTG GAC GAG CCT GCC CCT GAC AGC ATC ATC CCA TCT CAG GAA CCC ATA GAT CCC CTG GTC ATG GAG AAA TAT ACC CAC AGG CTG CAC ACT GAG GTC TAT GGG CTG CTG GAT GCC CTG GTG ACC GAC CTG CTG GCC CTG GCT GAT GAA CTC AAC CCC CAA AAG AAT GCT GAG GAG CCT TTG CAT CTC GGC ACC ,21.0
ATG TGG GGG GGG CTC TGG CTT CTG CTG CTG AGC TTC CTC ACA GCT ACT GCT GTC CCC GGA CCC TCG CTG CGG AGG CCT GCC AGG GAA CTC GAT GCC ACC CCT CGA ACA ACC ATC TCC TAT GAA GAG CTT TCC GGG ACC CGG CAC TTC AAG GGC CGA GCC CAG AAC TAC TCA ACG CTA CTG CTG GAG GAG GCT TCG GCA AGG CTG CTA GTG GGA GCC CGT GGT GCC CTG TTC TCT CTC AAT GCC CAT GAC ATA GGA GAT GGG GCT CAC AAA GAG ATC CTT TGG GAG GCC TCT CCA GAG ATG CAA AGT AAA TGT CAT CAA AAA GGG AAG AAC AAC CAG ACC GAG TGC TTC AAC CAT GTG CGA TTC CTG CAG CGG CTC AAC GCC ACC CAC CTC TAC GCG TGC GGG ACT CAC GCC TTC CAG CCC CTC TGT GCA GCC ATC GAT TCG GAG GCC TTC ACC TTG CCA ACC AGC TTT GAG GAA GGA AAG GAG AAG TGT CCC TAC GAT CCC GCC CGA GGC TTC ACG GGA CTC ATC ATC GAT GGA GGC CTA TAC ACA GCC ACA CGG TAT GAA TTC CGG AGC ATT CCT GAC ATC CGC CGG AGT CGA CAC CCA CAC TCC TTG AGA ACT GAG GAG GCG CCG ATG CAC TGG CTC AAT GAT GCA GAG TTT GTC TTC TCC GTC CTG GTG CGG GAG AGC AAG GCC AGC GCT GCG GGT GAC GAC GAC AAG GTT TAC TAC TTC TTC ACC GAG CGC GCT GCC GAG GAG GGC TCG GGC AGC TTT CCC CAG AGC CGC AGC AGC CAC CGC GTA GCC CGC GTG GCC CGT GTG TGC AAG GGA GAC CTG GGA GGG AGG AAG ATC CTG CAG AAG AAA TGG ACC TCC TTC TTG AAG GCG CGT CTC TTC TGC CAC ATT CCA CAA TAT GAG ACT CTG CGC GAC GTC TGC AGC CTG GAC ACT GAC GCC TCG GCC CGC ACA CAT TTC TAT GCT GCC TTC ACG TTG ACC ACA CAG TGG AAG ACC CTG GAG GCG TCG GCC ATC TGC CGC TAT GAC CTG GCT GAG GTG CAG ACT GTC TTC ACA GGC CCC TAC ATG GAA TAC CAG GAT GGC GCC CGG CGC TGG GGC CGC TAC GAG GGT GGG GTG CCG GAG CCC CGG CCC GGC TCA TGC ATC ACA GAT TCG CTG CGC AGC CGA GGC TAC AAT TCA TCC CAG GAC TTA CCA TCC CTG GTC CTG GAC TTT GTG AAA TTG CAC CCA CTG ATG GCT CGG CCA GTA CTG CCC ACA CGG GGA CGG CCT CTG CTG CTC AAG CGC AGT GTG CGG TAC ACG CAC CTC ACA GGG ACA CCG GTC ACC ACC CCT GCT GGA CTC ACC TAC GAC CTG CTC TTT CTG GGC ACA GCT GAT GGC TGG ATC CAC AAG GCT GTG GTC CTG GGC TCT GGG ATG CAC ATT ATT GAA GAG ACA CAG GTG TTC AAG GAG CCC CAA CCT GTG GAG AAT CTG GTC ATC TCT TCA ATG CAG CAC AGC CTC TAC GTG GGA GCC CCG AGT GGC GTC ACC CAG TTG CCT CTC TCC AGC TGC TCT CGC TAC CGC TCC TGC TAT GAC TGC ATC CTG GCC CGG GAC CCT TAC TGC GGC TGG GAC CCC AGC ACC CAT ACC TGC GTG GTG GCC ACC ACT GTA GCC AAC AGA TCC CAG AGT AGC AGG ACA GCA GTG ATA CAG GAC ATA GAG AGA GGA AAC CGA GGC TGT GAG GGC AAC AGC AAC ACA GGG CCA CCA CCA CCA CTG AAG ACC CGC TCT GTC CTC CGG GGT GAT GAT GTC CTC CTG CCC TGT GAC CAG CCA TCC AAC CTG GCG AGG GCC CTG TGG CTG CTC AAT GGG AGC AGG GGC CTG AGT GAC GGG CAG GAC GGC TAC CGC GTG GGT GTG GAC GGG CTG CTG GTG ACT GAC ACG CAG CCC GAG CAC AGC GGC AAC TAC GGC TGC TAC GCG GAG GAG AAT GGC CTC CGC ACC CTG TTA GCG TCC TAT AGC CTC ACC GTC CGG CGG GCC ACT CCT GCC CCA GCT CCG CAA GCT CCT GCC ATG CCT GGG GCA CAA CTG GCA CCT GAT GTG AGG CTG CTC TAT GTG TTA GCC ATC GCG GCG CTA GGT GGC CTC TGC CTC ATC CTG GCT TCC TCC CTC CTC TAT ATG GCC TGT CTT CGA GGG GGC AGA CGA GGC CGG AGA CGA AAG TAC TCC CTG GGC CGG GCG GGC CGG GCA GGG GGC TCC GCT GTG CAG CTG CAG ACA GTC TCA GGC CAG TGT CCA GGA GAG GAA GAT GAA GGG GAC GAT GGG GAG GGG CCT GGG GGC ATG GAA GGC GGC TGC CTC CAG ATC ATC CCT GGG GAG GGA GCC CCA GCA CCG CCG CCC CCA CCA CCT CCA CTG CCA CCG GCT GAG CTG ACC AAT GGG CTG GTG GCG CTG CCC AGT CGG CTG CGC AGG ATG AAT GGC AAC AGC TAC GTG CTC CTG AGG CAG AGC CCC AAC GGA GTG CCA GCA GGG CCC TGC TCC TTC GCC GAG GAG CTC AGC CGC ATC CTA GAG AAG AGG AAG CAC ACG CAG CTG GTA GAG CAC CTG GAT GAG AGC TCC GTC ,6.2
ATG GGT CGC TCC AAT TCT AGA TCA CAT TCT TCA AGG TCA AAG TCT AGA TCA CAG TCT AGT TCT CGA TCA AGA TCA AGA TCT CAT TCT CGA AAG AAG CGA TAC AGT TCT AGG TCT CGT TCC AGA ACA TAT TCA AGG TCT CGT AGT AGA GAT CGT ATG TAT TCT AGA GAT TAT CGT CGC GAT TAC AGA AAT AAT AGA GGA ATG AGA CGA CCT TAT GGG TAC AGA GGA AGG GGT AGA GGG TAT TAT CAA GGA GGA GGA GGT AGA TAT CAT CGA GGT GGT TAT AGA CCT GTC TGG AAT AGA AGG CAC TCT AGG AGT CCT AGA CGA GGT CGT TCA CGT TCC AGG AGT CCA AAA AGA AGA TCC GTT TCT TCT CAA AGA TCC AGA AGC AGA TCT CGC CGG TCA TAT AGA TCT TCT AGG TCT CCA AGA TCA TCC TCT TCT CGT TCT TCA TCC CCA TAT AGC AAA TCT CCT GTT TCT AAA AGA CGA GGG TCT CAG GAA AAA CAA ACC AAA AAA GCT GAA GGG GAA CCC CAA GAA GAG AGT CCG TTG AAA AGT AAA TCA CAG GAG GAA CCA AAA GAT ACA TTT GAA CAT GAC CCA TCT GAG TCT ATC GAT GAA TTT AAT AAG TCA TCA GCC ACA TCT GGT GAT ATT TGG CCT GGC CTT TCA GCT TAT GAT AAT AGT CCT AGA TCA CCC CAT AGT CCT TCA CCT ATT GCT ACA CCA CCT AGT CAG AGT TCA TCT TGC TCT GAT GCT CCC ATG CTC AGT ACA GTT CAC TCT GCA AAA AAT ACT CCT TCT CAG CAT TCA CAT TCC ATT CAG CAT AGT CCT GAA AGG TCT GGG TCT GGT TCT GTT GGA AAT GGA TCT AGT CGA TAC AGT CCT TCT CAG AAT AGT CCA ATT CAT CAC ATC CCT TCA CGA AGA AGT CCT GCA AAG ACA ATC ACA CCA CAG AAT GCT CCA AGA GAT GAG TCT AGG GGC CGT TCC TCA TTT TAT CCT GAT GGT GGA GAT CAG GAA ACT GCA AAG ACT GGG AAG TTC TTA AAA AGG TTC ACA GAT GAA GAG TCT AGA GTA TTC CTG CTT GAT AGG GGT AAT ACC AGG GAT AAA GAG GCT TCA AAA GAG AAA GGA TCA GAG AAA GGG AGG GCA GAG GGA GAA TGG GAA GAT CAG GAA GCT CTA GAT TAC TTC AGT GAT AAA GAG TCT GGA AAA CAA AAG TTT AAT GAT TCA GAA GGG GAT GAC ACA GAG GAG ACA GAG GAT TAT AGA CAG TTC AGG AAG TCA GTC CTC GCA GAT CAG GGT AAA AGT TTT GCT ACT GCA TCT CAC CGG AAT ACT GAG GAG GAA GGA CTC AAG TAC AAG TCC AAA GTT TCA CTG AAA GGC AAT AGA GAA AGT GAT GGA TTT AGA GAA GAA AAA AAT TAT AAA CTT AAA GAG ACT GGA TAT GTA GTG GAA AGG CCT AGC ACT ACA AAA GAT AAG CAC AAA GAA GAA GAC AAA AAT TCT GAA AGA ATA ACA GTA AAG AAA GAA ACT CAG TCA CCT GAG CAG GTA AAG TCT GAA AAG CTC AAA GAC CTC TTT GAT TAC AGT CCC CCT CTA CAC AAG AAT CTG GAT GCA CGA GAA AAG TCT ACC TTC AGA GAG GAA AGC CCA CTT AGG ATC AAA ATG ATA GCG AGT GAT TCT CAC CGT CCT GAA GTC AAA CTC AAA ATG GCA CCC GTT CCT CTT GAT GAT TCT AAC AGA CCT GCT TCC TTG ACT AAA GAC AGG CTG CTT GCT AGT ACA CTT GTC CAT TCT GTC AAG AAG GAG CAA GAA TTC CGA TCC ATC TTT GAC CAC ATT AAG TTG CCA CAA GCC AGC AAA AGC ACT TCA GAG TCA TTT ATT CAA CAC ATT GTG TCC TTG GTT CAT CAT GTT AAA GAG CAA TAC TTC AAG TCA CCT GCA ATG ACC CTA AAC GAG CGG TTC ACT TCG TAT CAG AAA GCC ACT GAA GAA CAT AGT ACT CGG CAA AAG AGC CCT GAA ATA CAC AGG AGA ATT GAC ATC TCA CCA AGT ACC CTG AGG AAG CAT ACC CGT TTA GCA GGG GAA GAG AGA GTT TTT AAA GAA GAA AAT CAA AAG GGA GAT AAA AAA TTA AGG TGT GAC TCT GCT GAC CTT CGG CAT GAC ATT GAT CGC CGT AGA AAA GAA AGA AGT AAA GAG CGG GGA GAT TCC AAG GGC TCC AGG GAA TCC AGT GGA TCA AGA AAG CAG GAA AAA ACT CCA AAA GAT TAC AAG GAA TAC AAA TCT TAC AAA GAT GAC AGC AAA AAT GTA TTT GTC TTT TAC ACG GCT TAT GGT GGA ,59.0
ATG TTG ATG GCA GAA CAG AGG GGC GCC TGG ACC ATG GGC GAC GTG GTA GAG AAG AGT TTG GAA GGG CCG CTG GCA CCT TCT ATG GAT GAG GCC TCC CAG AAA AGA GGA GAC CTG GTA GAA ATC TTA AAT GGG GAT AAG GTA AAA TTC GAT GAC ACG GGA CTC TCC TTA ATT CTG CAG AAT GGC TTG GAC ACC CTC CGC GTG GAA AAT GCT CTG ACA GAT GTC ATC TTG TGT GTG GAC ATT CAG GAA TTC TCC TGC CAC CGC GTG GTG CTT GCC GCG GCC AGC AAC TAC TTC AGG GCC ATG TTC TGC AAT GAT TTG AAG GAA AAG TAT GAG AAG AGG ATC ATT ATC AAA GGG GTT GAT GCC GAG ACC ATG CAC ACT CTT CTG GAC TAC ACG TAC ACC AGC AAG GCG CTG ATC ACC AAG CAG AAT GTG CAA CGG GTC CTG GAA GCT GCT AAC CTA TTC CAG TTC CTG CGG ATG GTG GAT GCC TGT GCC AGC TTC CTA ACA GAA GCC TTG AAC CCA GAA AAC TGT GTT GGA ATA CTG AGG CTG GCA GAT ACA CAC TCC TTG GAC AGC CTG AAA AAG CAG GTG CAA AAT TAC ATC ATC CAA AAC TTT GTG CAG ATT CTG AAT TCT GAG GAG TTC CTT GAA CTT CCC GTG GAC ACA CTG TAC CAT ATC TTG AAG AGT GAT GAG CTT TAT GTG ACA GAG GAG GCT CAG GTG TTT GAG ACT GTG ATG AGT TGG GTC CGG CAC AAA CAA TCA GAA CGA CTC TGC TTG CTC CCG TAC ATC CTT GAG AAT GTG CGC TTG CCA CTT CTG GAC CCG TGG TAC TTT GTG GAC ACG GTG GAG GCA GAT CCT CTC ATC AGA CAG TGT CCA GAG GTC TTC CCG CTG CTG CAG GAA GCC AGG ATG TAC CAC CTT TCA GGC AAT GAG ATC ATT TCG GAG CGC ACC AAG CCC AGA ATG CAT GAG TTT CAG TCT GAG GTA TTC ATG ATC ATT GGT GGC TGC ACG AAG GAT GAA CGG TTT GTG GCG GAG GTA ACC TGC CTG GAC CCC CTG AGG CGC AGC CGC CTG GAG GTG GCC AAG CTC CCC ATG ACG GAG CAT GAG CTG GAG AGT GAG AAT AAG AAG TGG GTG GAG TTT GCA TGC GTG ACA TTA AAA AAT GAG GTC TAC ATC TCA GGT GGC AAA GAG ACA CAG CAT GAT GTT TGG AAA TAT AAT TCT TCA ATC AAC AAA TGG ATT CAA ATT GAA TAT TTG AAC ATA GGC CGC TGG AGG CAT AAG ATG GTA GTG TTA GGT GGC AAA GTC TAT GTG ATT GGA GGT TTT GAT GGC TTA CAG AGG ATC AAC AAT GTG GAG ACC TAT GAT CCC TTC CAT AAC TGC TGG TCA GAG GCA GCA CCC CTT CTT GTC CAC GTC AGT TCC TTC GCA GCT ACC AGC CAT AAG AAG AAG CTC TAT GTG ATT GGG GGC GGG CCC AAT GGG AAA CTG GCC ACA GAC AAG ACT CAG TGC TAT GAC CCT TCA ACC AAT AAA TGG AAT TTA AAG TCG TCC ATG CCA GTG GAG GCT AAA TGC ATC AAT GCA GTC AGT TTC CGG GAC CGC ATC TAT GTT GTT GGA GGG GCC ATG AGA GCC CTG TAC GCC TAC AGT CCC CTG GAA GAC AGC TGG TGC CTG GTG ACC CAG CTC AGC CAC GAG AGG GCC AGC TGC GGC CTC GCG CCC TGC AAC AAC CGC CTC TAC ATC ACG GGG GGG CGG GAC GAG AAG AAC GAG GTC ATC GCC ACG GTG CTG TGC TGG GAC CCC GAG GCC CAG AAA CTG ACT GAG GAA TGT GTC CTG CCG CGG GGG GTG TCG CAC CAC GGC AGC GTC ACC ATC AGG AAG TCT TAC ACC CAC ATC CGG AGG ATC GTG CCC GGA GCC GTG TCT GTG ,23.1
ATG GCC ACT CAA GCT GAC TTG ATG GAA TTA GAC ATG GCG ATG GAA CCA GAT AGA AAA GCT GCT GTT AGC CAC TGG CAG CAG CAG TCT TAC CTG GAT TCT GGA ATC CAT TCT GGT GCC ACA ACA ACA GCT CCC TCC CTG AGT GGC AAA GGA AAT CCT GAG GAG GAA GAT GTA GAT ACT ACC CAA GTC TTA TAT GAA TGG GAA CAG GGA TTT TCT CAG TCC TTC ACA CAA GAA CAG GTA GCT GAT ATT GAT GGC CAG TAC GCC ATG ACC AGA GCT CAG AGA GTA CGA GCT GCC ATG TTC CCT GAA ACG CTG GAT GAG GGC ATG CAG ATC CCA TCC ACT CAG TTT GAT GCG GCT CAC CCC ACG AAT GTT CAG CGT TTG GCC GAG CCT TCT CAG ATG CTG AAG CAT GCC GTG GTG AAC CTC ATC AAC TAC CAG GAC GAT GCG GAA CTG GCC ACT CGA GCA ATT CCT GAA CTG ACC AAA CTG CTG AAT GAC GAG GAT CAG GTG GTG GTT AAT AAG GCT GCA GTT ATG GTT CAC CAG CTA TCT AAG AAA GAA GCT TCA AGG CAT GCC ATA ATG CGC TCT CCC CAG ATG GTA TCT GCT ATT GTG CGC ACC ATG CAG AAT ACA AAT GAT GTG GAA ACA GCA CGC TGT ACT GCT GGA ACA CTG CAC AAT CTT TCC CAT CAC CGT GAA GGC TTA TTG GCT ATC TTT AAG TCT GGT GGC ATT CCT GCC CTT GTG AAA ATG CTT GGC TCC CCA GTG GAT TCT GTG TTA TTT TAT GCC ATT ACG ACT CTC CAC AAC CTT TTA TTA CAT CAA GAA GGA GCC AAA ATG GCA GTG CGT CTT GCT GGT GGA CTA CAA AAA ATG GTT GCT TTG CTC AAC AAA ACA AAT GTT AAA TTC TTG GCT ATT ACA ACA GAC TGT CTT CAG ATT TTG GCT TAT GGC AAT CAA GAA AGC AAG CTG ATC ATT CTG GCT AGT GGT GGG CCC CAG GCT CTG GTA AAC ATA ATG AGG ACT TAT ACC TAT GAA AAA CTC CTG TGG ACC ACA AGT AGA GTA CTG AAG GTT TTG TCA GTC TGC TCT AGT AAC AAA CCA GCT ATT GTG GAA GCT GGT GGA ATG CAA GCT TTA GGA CTT CAC CTT ACA GAT CCA AGT CAA CGT CTT GTA CAG AAC TGT CTC TGG ACT CTT AGG AAT CTT TCA GAT GCT GCA ACT AAG CAG GAA GGA ATG GAA GGT CTT CTA GGG ACT CTG GTT CAG CTT TTA GGC TCG GAT GAT ATA AAT GTT GTC ACC TGT GCT GCT GGC ATC CTT TCT AAC CTC ACC TGC AAT AAC TAC AAG AAC AAG ATG ATG GTG TGC CAA GTT GGT GGA ATT GAA GCT CTT GTT CGC ACT GTT CTT CGT GCT GGT GAT AGG GAG GAT ATC ACT GAA CCT GCC ATC TGT GCT CTT CGT CAT TTG ACT AGC AGA CAC CAG GAA GCT GAG ATG GCA CAG AAT GCT GTC CGC CTC CAT TAT GGG CTC CCA GTG GTG GTT AAG CTC TTA CAT CCG CCA TCT CAC TGG CCT CTG ATA AAG GCT ACT GTT GGT CTC ATC CGA AAT CTT GCC CTT TGC CCA GCA AAT CAT GCG CCT TTA CGT GAG CAA GGT GCA ATT CCC CGG TTA GTT CAG TTG TTG GTG AGA GCG CAT CAG GAT ACG CAG CGC CGG ACT TCA ATG GGT GGA ACA CAG CAG CAG TTT GTG GAG GGA GTT CGT ATG GAA GAA ATT GTG GAA GGT TGC ACT GGA GCC CTT CAT ATC CTC GCC CGA GAT GTC CAC AAT CGA ATC GTT ATC AGG GGT CTA AAT ACC ATT CCA CTG TTT GTG CAG TTG CTG TAT TCC CCT ATT GAA AAC ATC CAG AGA GTG GCT GCA GGG GTA CTC TGT GAA CTG GCT CAG GAC AAG GAG GCC GCA GAA GCA ATT GAG GCC GAG GGA GCC ACT GCT CCT CTG ACA GAA TTA CTG CAC TCT AGA AAC GAG GGT GTG GCT ACA TAC GCA GCC GCC GTA TTG TTC CGA ATG TCT GAG GAC AAG CCA CAG GAC TAC AAG AAG CGA CTT TCT GTT GAA CTG ACC AGC TCG CTC TTC AGA ACT GAA CCA ATG ACT TGG AAT GAG ACT GCT GAT CTT GGA CTT GAT ATT GGT GCC CAA GGA GAA CCC CTT GGT TAT CGT CAG GAT GAT CCT AGC TAT CGT TCT TTC CAC TCT GGG GGC TAT GGC CAG GAT GCC TTG GGT ATG GAC CCC ATG ATG GAA CAT GAA ATG GGT GGC CAC CAT CCA GGT GCT GAT TAT CCA GTT GAT GGG CTT CCA GAT CTG GGA CAT GCC CAG GAC CTT ATG GAT GGG TTG CCT CCT GGT GAC AGT AAT CAG TTG GCT TGG TTC GAT ACT GAC CTG ,14.1
ATG GCG GTG TCC TGG AGG AGC TGG CTG GCC AAC GAA GGG GTT AAA CAC CTC TGC CTG CTC ATT TGG CTG TCC CTA AAT GTC CTG CTT TTC TGG AAA ACC TTC CTG CTG TAC AAT CAA GGG CCA GAA TAC TAC TAC ATC CAC CAG ATG TTG GGC GTA GGA TTG TGT CTA AGC AGA GCC TCT GCA TCT GTC CTG AAC CTC AAC TGC AGC CTT ATC CTT TTA CCC ATG TGC CGG ACA CTC CTG GCT TAT CTT CGA GGA TCA CAG AAG GTT CCA AGC AGG AGA ACA AGA AGA TTA TTG GAT AAA AGT AAG ACA TTC CAC ATA ACC TGT GGC ATA ACT ATC TGT ATT TTC TCA GGT GTG CAT GTG GCT GCC CAC TTG ATG AAT GCC CTC AAC TTC TCA GTG AAC TAT AGC GAA GAT TTC CTT GAA CTG AAT GCA GCG AGA TAC CGA AAT GAG GAT CCT AGA AAG CTT CTC TTC ACA ACT GTT CCG GGT CTG ACG GGT GTC TGC ATG GTG GTG GTA CTG TTC CTC ATG GTT ACA GCT TCT ACC TAT GCA ATA AGA GTT TCT AAT TAT GAT ATC TTC TGG TAC ACT CAC AAC CTC TTC TTT GTC TTC TAC ATG CTG CTG CTG TTG CAT GTT TCA GGT GGG CTG TTG AAG TAT CAA ACC AAT TTG GAT ACC CAC CCT CCT GGC TGC ATC AGT CTT AAC CAG ACC CAG TCT CAG GAT ATT TCC TCA CTA GAA TAC ATC TCA GAA CAT TTT CAT GGA TCT TGG CCT GAA GGA TTT TCA AAA CTA GAA GGT CAT AAC CAG AAA ACA GTT GTG AAG ATT TGC CTT GAG GAA CCC AAG TTT CAA GCC CAT TTT CCA CAG ACC TGG ATT TGG ATT TCT GGA CCT TTG TGC CTG TAC TGT GCT GAG AGA CTT TAC CGA TGT ATC AGG AGC AAC AAA CCT GTT ACC ATC ATC TCA GTA ATC AAT CAT CCC GCA GAT GTC ATG GAA CTC CGA ATG GTC AAA GAA AAC TTT AAA GCA AGA CCT GGC CAG TAT GTT ATT CTA CAT TGT CCC AGT GTA TCA GCA TTA GAA AAC CAC CCA TTT ACT CTC ACG ATG TGT CCT ACT GAA ACC AAA GCA ACA TTT GGT GTC CAC TTT AAA GTA GTA GGA GAC TGG ACA GAA CGA TTC CGA GAT TTA CTA CTG CCT CCA TCT AGC CAA GAC TCT GAG ATT CTG CCC TTC ATT CAA TCT AGA AAT TAT CCC AAG GAT GAC TGG AAG CCG TAC AAG CTA AGA AGA CTG TAC TTT ATC TGG GTA TGC AGA GAC ATC CAA TCA TTC CAG TGG TTT GCA GAC TTA CTC TGT ATG TTA CAT AAT AAG TTT TGG CAA GAA AAC AGA CCT GAC TAT GTG AAC ATC CAG CTG TAC CTC AGT CAA ACA GAT GGA ATA CAG AAG ATA ATT GGA GAA AAA TAT CAC ACA CTG AAT TCT AGG CTT TTT ATT GGA CGC CCT CGG TGG AAG CTT TTA TTT GAC GAA ATA GCA AAA TGT AAC AGA GGG AAA ACA GTT GGA GTT TTC TGC TGT GGA CCA AGT TCG ATT TCC AAG ACT CTT CAT AAT TTG AGT AAC CAG AGC AAC TCA TAT GGG ACA AAA TTT GAG TAC AAT AAA GAA TCC TTC AGC ,5.5
ATG GAA GAA GGC TTC AGA GAC CGG GCA GCT TTC ATC CGT GGG GCC AAA GAC ATT GCC AAG GAA GTC AAG AAG CAT GCG GCC AAG AAG GTG GTG AAG GGC CTG GAC AGA GTC CAG GAT GAA TAT TCC CGT AGA TCC TAC TCC CGC TTT GAG GAG GAG GAC GAT GAC GAT GAC TTC CCT GCC CCT GCT GAT GGC TAT TAC CGT GGG GAA GGG GCC CAG GAC GAG GAG GAA GGT GGC GCA TCC AGT GAT GCC ACT GAG GGC CAC GAT GAG GAT GAT GAG ATC TAT GAG GGG GAA TAT CAG GGC ATC CCC CGG GCA GAG TCT GGG GGC AAA GGC GAG CGG ATG GCA GAT GGG GCT CCC CTG GCT AGA GGG AGG GGG GGC TTG GGT GAT GGG GAG GGC CCT CCT GGT GGC CTG GGG GAG GCG CAA CGG CGG AAA GAA CGG GAA GAA CTA GCT CAG CAG TAC GAA GCC ATC CTC CGG GAG TGT GGC CAT GGC CGC TTC CAG TGG ACA CTC TAT TTC GTG CTT GGC CTG GCG CTG ATG GCT GAT GGT GTC GAA GTC TTT GTG GTG GGC TTT GTG CTG CCC AGT GCT GAA AAG GAC ATG TGC CTG TCA GAC TCC AAT AAA GGC ATG CTA GGA CTT ATA GTC TAC CTG GGC ATG ATG GTG GGA GCC TTC CTC TGG GGA GGT CTG GCT GAT CGG CTG GGC CGG AGG CAG TGT CTG CTC ATC TCG CTC TCG GTC AAC AGC GTC TTC GCC TTT TTC TCA TCT TTC GTC CAG GGT TAT GGC ACT TTC CTC TTC TGC CGC CTC CTT TCC GGG GTT GGG ATT GGA GGG TCC ATC CCC ATT GTC TTT TCC TAT TTC TCG GAG TTT CTG GCC CAG GAG AAA CGT GGG GAG CAT TTG AGC TGG CTC TGC ATG TTT TGG ATG ATT GGT GGA GTG TAT GCC GCT GCC ATG GCC TGG GCC ATC ATC CCC CAC TAT GGA TGG AGC TTT CAG ATG GGG TCC GCT TAC CAG TTC CAC AGC TGG AGG GTG TTT GTC CTT GTT TGT GCC TTC CCT TCC GTG TTT GCC ATC GGC GCA CTG ACC ACA CAG CCG GAG AGC CCC CGC TTC TTC CTG GAG AAC GGG AAG CAT GAT GAG GCC TGG ATG GTG CTG AAG CAG GTT CAT GAC ACC AAC ATG CGA GCC AAG GGC CAT CCT GAG CGA GTC TTC TCT GTA ACC CAC ATT AAG ACG ATT CAT CAG GAG GAT GAG TTG ATC GAA ATC CAG TCA GAC ACG GGG ACT TGG TAC CAG CGC TGG GGG GTC CGG GCC CTG AGC CTG GGG GGG CAG GTT TGG GGC AAT TTC CTC TCC TGT TTT GGT CCC GAA TAT CGA CGC ATC ACT CTG ATG ATG ATG GGC GTG TGG TTC ACC ATG TCA TTC AGC TAC TAC GGC CTG ACT GTC TGG TTT CCT GAC ATG ATC CGC CAT CTC CAG GCA GTG GAC TAT GCA GCC CGG ACC AAG TTG TTC TCT GGG GAG CGT GTG GAG CAC GTG ACC TTT AAT TTC ACG CTG GAG AAT CAG ATC CAC CGC GGG GGA CAG TAC TTC AAT GAC AAG TTC ATC GGG CTG CGT CTG AAG TCA GTG TCC TTT GAG GAT TCC TTG TTT GAG GAG TGT TAT TTC GAG GAT GTC ACT TCG AGC AAC ACA TTC TTC CGC AAC TGC ACG TTC ATC AAC ACT GTG TTC TAT AAC ACT GAC CTG TTT GAG TAC AAG TTT GTG AAC AGC CGT CTG GTG AAC AGC ACG TTC CTG CAC AAC AAG GAG GGC TGC CCA CTG GAC GTG ACA GGG ACC GGC GAA GGC GCC TAC ATG GTG TAC TTT GTC AGC TTC TTG GGG ACG CTG GCT GTG CTT CCC GGG AAC ATC GTG TCT GCC CTG CTT ATG GAC AAG ATT GGC AGG CTC CGG ATG CTT GCT GGC TCC AGC GTG ATG TCC TGT GTC TCC TGC TTC TTC CTG TCT TTT GGG AAC AGC GAG TCA GCC ATG ATC GCC CTG CTC TGC CTT TTT GGG GGG GTC AGC ATT GCA TCC TGG AAC GCG CTG GAC GTG TTG ACC GTT GAA CTC TAC CCC TCG GAC AAG AGG ,27.0
ATG TAC CAG GGA CAC ATG CAG GGA AAA GGC TCT AGG GCG GCA GAT AAG GCT GTT GCC ATG GTG ATG AAG GAG ATA CCG AGG GAG GAG TCT GCT GAA GAA AAG CCC CTC CTT ACT ATG ACA TCA CAG CTG GTG AAT GAA CAG CAA GAA AGC AGA CCC CTC CTG AGT CCC TCC ATC GAT GAC TTT CTC TGT GAA ACC AAA TCG GAG GCA ATA GCA AGG CCA GTA ACG TCC AAC ACA GCC GTA TTG ACT ACA GGC TTA GAT CTC CTT GAC TTG AGT GAA CCT GTC TCT CAA ACC CAA AGC AAA GCC AAG AAG TTG GAG GCC TCA TCA AAA ACC TCA TCC CTC AAG AAA AAG GCT GAT GGG TCT GAC CTC ATC AGT GCA GAT GCT GAG CAG AGA GGC CAG GCT CTC CGA GGC TCA GAG ACA GCA TCC TTA GAC TTA AAC ATT CAA ACA CAA CTG GAA AAA TGG GAT GAT GTT AAG TTT CAT GGA GAT CGA AAT AGC AAG GGG CAT CCC ATG GCA GAG AGA AAA TCA AGC TCA TCT AGA ACT GGA TCA AAA GAA CTT TTA TGG TCT TCA GAG CAC AGA TCT CAG CCA GAA CTA AGT GGT GGG AAA AGC GCC TTG AAC TCT GAG TCA GCT TCG GAG CTG GAA TTA GTG CCT CCA ACA CAG GCT CGA CTG ACC AAA GAG CAG CGC TGG GGG AGC GCC TTG CTT TCC AGA AAC CAT TCC TTA GAA GAA GAA TTT GAA AGA GCG AAA GCA GCT GTG GAG TCA GAT ACA GAG TTT TGG GAT AAG ATG CAA GCA GAA TGG GAA GAA ATG GCC CGG AGG AAC TGG ATA TCG GAG AAC CAG GAA GCC CAG AAC CAG GTT ACA ATC TCA GCC AGT GAA AAG GGT TAT TAC TTT CAT ACT GAA AAC CCC TTC AAA GAT TGG CCT GGA GCA TTT GAA GAA GGC TTA AAA AGG CTG AAG GAA GGG GAC CTG CCA GTC ACC ATC CTG TTC ATG GAG GCA GCA ATT CTT CAA GAC CCT GGA GAT GCA GAG GCA TGG CAG TTC CTC GGG ATA ACC CAG GCA GAG AAT GAA AAT GAA CAA GCA GCT ATT GTC GCC CTC CAG AGG TGC TTA GAA TTG CAG CCC AAC AAC TTG AAA GCT CTG ATG GCT CTG GCT GTG AGT TAC ACT AAC ACT GGC CAT CAG CAA GAT GCT TGT GAA GCT TTA AAG AAC TGG ATT AAG CAG AAT CCA AAG TAC AAA TAC CTT GTG AAG AGC AAG AAG GGA TCT CCA GGC CTC ACC CGG AGG ATG TCT AAG TCT CCA GTT GAT AGC TCT GTT CTG GAA GGA GTG AAG GAA TTA TAC CTG GAA GCT GCC CAC CAA AAT GGA GAT GTG ATC GAC CCA GAT CTG CAG ACA GGC TTG GGG GTG CTG TTC CAC CTG AGT GGA GAA TTT AAT AGA GCA ATA GAC GCG TTT AAT GCT GCC TTA ACT GTT CGA CCA GAG GAC TAT TCA TTA TGG AAC CGT CTT GGG GCA ACC TTG GCA AAT GGA GAC CGC AGC GAG GAG GCT GTG GAG GCC TAC ACA CGA GCG CTG GAG ATT CAG CCA GGC TTC ATC CGG TCC AGA TAC AAC CTG GGG ATA AGC TGC ATC AAC CTG GGC GCC TAC AGA GAA GCG GTC AGC AAT TTT CTC ACT GCC CTC AGT TTG CAA AGA AAG AGC AGG AAT CAG CAG CAA GTC CCT CAT CCT GCA ATC TCT GGG AAT ATC TGG GCT GCC CTT AGA ATT GCC CTT TCT CTG ATG GAC CAG CCG GAA CTC TTC CAG GCG GCT AAT CTC GGT GAT CTG GAT GTC CTC CTA AGA GCT TTC AAC TTG GAT CCT ,15.3
